nombre producto,precio,link,categoria,fecha
Chaqueta Mujer Blizzard B-Dry Hoody Jacket Laurel Lippi,CLP 89.990,https://www.lippioutdoor.com/chaqueta-mujer-blizzard-b-dry-hoody-jacket-laurel-lippi-m22.html,mujer,2022-07-27
Polera Deportiva Mujer Core Turquesa Lippi,CLP 9.990,https://www.lippioutdoor.com/polera-deportiva-mujer-core-turquesa-turquesa-v21.html,mujer,2022-07-27
Chaqueta Mujer Warmy Sweatshirt Arena Lippi,CLP 24.990,https://www.lippioutdoor.com/chaqueta-mujer-warmy-sweatshirt-arena-lippi-m22.html,mujer,2022-07-27
Botin Mujer Woods Pro Mid Terracota Lippi,CLP 99.990,https://www.lippioutdoor.com/botin-mujer-woods-pro-mid-terracota-i21.html,mujer,2022-07-27
Botin Mujer Puelo CS Hi Verde Lippi,CLP 74.990,https://www.lippioutdoor.com/botin-mujer-puelo-cs-hi-verde-i21.html,mujer,2022-07-27
Chaqueta Mujer Paicavi Therm-Pro Jacket Burdeo Lippi,CLP 43.990,https://www.lippioutdoor.com/chaqueta-mujer-paicavi-therm-pro-jacket-burdeo-i21.html,mujer,2022-07-27
Polera Mujer Core T-Shirt Negro Lippi,CLP 9.990,https://www.lippioutdoor.com/polera-mujer-core-t-shirt-negro-i21.html,mujer,2022-07-27
Primera Capa Mujer Skintec 2000 Seamless Top High Negro Lippi,CLP 29.990,https://www.lippioutdoor.com/primera-capa-mujer-skintec-2000-seamless-top-high-negro-lippi-m22.html,mujer,2022-07-27
Chaqueta Mujer Baggy Sweatshirt Grafito Lippi,CLP 29.990,https://www.lippioutdoor.com/chaqueta-mujer-baggy-sweatshirt-grafito-lippi-m22.html,mujer,2022-07-27
Chaqueta Mujer Macaya Softshell Hoody Jacket Melange Purpura Lippi,CLP 64.990,https://www.lippioutdoor.com/chaqueta-mujer-macaya-softshell-hoody-jacket-melange-purpura-lippi-m22.html,mujer,2022-07-27
Primera Capa Mujer Skintec 3000 Bottom Negro Lippi,CLP 43.990,https://www.lippioutdoor.com/primera-capa-mujer-skintec-3000-bottom-negro-i020.html,mujer,2022-07-27
Chaqueta Mujer Seek Softshell Hoody Jacket Vino Lippi,CLP 49.990,https://www.lippioutdoor.com/chaqueta-mujer-seek-softshell-hoody-jacket-vino-lippi-m22.html,mujer,2022-07-27
Chaqueta Mujer Sense Blend-Pro Jacket Melange Beige Lippi,CLP 47.990,https://www.lippioutdoor.com/chaqueta-mujer-sense-blend-pro-jacket-melange-beige-lippi-m22.html,mujer,2022-07-27
Chaqueta Mujer Peak Down Hoody Vino I20 Lippi,CLP 99.990,https://www.lippioutdoor.com/8226-chaqueta-mujer-peak-down-hoody-vino-i20.html,mujer,2022-07-27
Chaqueta Mujer Macaya Softshell Hoody Jacket Azul Marino Lippi,CLP 64.990,https://www.lippioutdoor.com/chaqueta-mujer-macaya-softshell-hoody-jacket-azul-marino-lippi-m22.html,mujer,2022-07-27
Botin Mujer Puelo CS Hi Jade Lippi,CLP 74.990,https://www.lippioutdoor.com/botin-mujer-puelo-cs-hi-jade-i21.html,mujer,2022-07-27
Chaqueta Mujer Paicavi Therm-Pro Jacket Verde Grisaceo Lippi,CLP 43.990,https://www.lippioutdoor.com/chaqueta-mujer-paicavi-therm-pro-jacket-verde-grisaceo-i21.html,mujer,2022-07-27
Polera Deportiva Mujer Core Rosado Lippi,CLP 9.990,https://www.lippioutdoor.com/poleradeportiva-mujer-core-rosado-rosado-v21.html,mujer,2022-07-27
Botin Mujer Puelo CS Hi Burdeo Lippi,CLP 74.990,https://www.lippioutdoor.com/botin-mujer-puelo-cs-hi-burdeo-i21.html,mujer,2022-07-27
Chaqueta Mujer Warmy Sweatshirt Grafito Lippi,CLP 24.990,https://www.lippioutdoor.com/chaqueta-mujer-warmy-sweatshirt-grafito-lippi-m22.html,mujer,2022-07-27
Poleron Mujer Stripes Nano-F Full Zip Hoody Azul Grisaceo Lippi,CLP 24.990,https://www.lippioutdoor.com/poleron-mujer-stripes-nano-f-full-zip-hoody-azul-grisaceo-i21.html,mujer,2022-07-27
Chaqueta Mujer Macaya Softshell Hoody Jacket Negro Lippi,CLP 64.990,https://www.lippioutdoor.com/chaqueta-mujer-macaya-softshell-hoody-jacket-negro-lippi-m22.html,mujer,2022-07-27
Chaqueta Mujer Paicavi Therm-Pro 1/4 Zip Jacket Gris Claro Lippi,CLP 39.990,https://www.lippioutdoor.com/chaqueta-mujer-paicavi-therm-pro-1-4-zip-jacket-gris-claro-lippi-m22.html,mujer,2022-07-27
Chaqueta Mujer Tres Cruces Fusion-3 Hoody Jacket Negro Lippi,CLP 169.990,https://www.lippioutdoor.com/chaqueta-mujer-tres-cruces-fusion-3-hoody-jacket-negro-lippi-m22.html,mujer,2022-07-27
Chaqueta Mujer Furry Shaggy-Pro Jacket Grafito Lippi,CLP 44.990,https://www.lippioutdoor.com/chaqueta-mujer-furry-shaggy-pro-jacket-grafito-lippi-m22.html,mujer,2022-07-27
Poleron Mujer Jacaranda Nano-F 1/4 Zip Hoody Crudo Lippi,CLP 42.990,https://www.lippioutdoor.com/poleron-mujer-jacaranda-nano-f-1-4-zip-hoody-crudo-lippi-m22.html,mujer,2022-07-27
Chaqueta Mujer Alamo Blend-Pro Hoody Jacket Taupe Lippi,CLP 47.990,https://www.lippioutdoor.com/chaqueta-mujer-alamo-blend-pro-hoody-jacket-taupe-lippi-m22.html,mujer,2022-07-27
Chaqueta Mujer Ferret Shaggy-Pro Jacket Verde Musgo Lippi,CLP 44.990,https://www.lippioutdoor.com/chaqueta-mujer-ferret-shaggy-pro-jacket-verde-musgo-lippi-m22.html,mujer,2022-07-27
Chaqueta Mujer Blizzard B-Dry Hoody Jacket Burdeo Lippi,CLP 89.990,https://www.lippioutdoor.com/chaqueta-mujer-blizzard-b-dry-hoody-jacket-burdeo-lippi-m22.html,mujer,2022-07-27
Poleron Mujer Jacaranda Mountain Nano-F 1/4 Zip Hoody Negro Lippi,CLP 44.990,https://www.lippioutdoor.com/poleron-mujer-jacaranda-mountain-nano-f-1-4-zip-hoody-negro-i21.html,mujer,2022-07-27
Bravo Mid Mujer Gris Lippi,CLP 119.990,https://www.lippioutdoor.com/4645-bravo-mid-all-mujer-gris.html,mujer,2022-07-27
Bravo Mid Mujer Morado Lippi,CLP 119.990,https://www.lippioutdoor.com/4646-bravo-mid-all-mujer-morado.html,mujer,2022-07-27
Poleron Mujer Warmy Sweatshirt Negro Lippi,CLP 29.990,https://www.lippioutdoor.com/poleron-mujer-warmy-sweatshirt-negro-lippi-4.html,mujer,2022-07-27
Chaqueta Mujer Baggy Sweatshirt Malva Lippi,CLP 29.990,https://www.lippioutdoor.com/chaqueta-mujer-baggy-sweatshirt-malva-lippi-m22.html,mujer,2022-07-27
Pantalon Mujer Dinamic Softshell Pants Negro Lippi,CLP 59.990,https://www.lippioutdoor.com/pantalon-mujer-dinamic-softshell-pants-negro-lippi-m22.html,mujer,2022-07-27
Poleron Mujer Jacaranda Nano-F 1/4 Zip Hoody Print Jade Oscuro Lippi,CLP 42.990,https://www.lippioutdoor.com/poleron-mujer-jacaranda-nano-f-1-4-zip-hoody-print-jade-oscuro-lippi-m22.html,mujer,2022-07-27
Chaqueta Mujer Numan Shaggy-Pro Jacket Laurel Lippi,CLP 39.990,https://www.lippioutdoor.com/chaqueta-mujer-numan-shaggy-pro-jacket-laurel-lippi-m22.html,mujer,2022-07-27
Primera Capa Mujer Skintec 3000 1/4 Zip Top Negro Lippi,CLP 54.990,https://www.lippioutdoor.com/primera-capa-mujer-skintec-3000-1-4-zip-top-negro-i020.html,mujer,2022-07-27
Chaqueta Mujer Warmy Sweatshirt Vino Lippi,CLP 24.990,https://www.lippioutdoor.com/chaqueta-mujer-warmy-sweatshirt-vino-lippi-m22.html,mujer,2022-07-27
Chaqueta Mujer Sense Blend-Pro Jacket Melange Negro Lippi,CLP 47.990,https://www.lippioutdoor.com/chaqueta-mujer-sense-blend-pro-jacket-melange-negro-lippi-m22.html,mujer,2022-07-27
Poleron Mujer Warmy Sweatshirt Malva Lippi,CLP 29.990,https://www.lippioutdoor.com/poleron-mujer-warmy-sweatshirt-malva-lippi-3.html,mujer,2022-07-27
Camisa Mujer Lumberjack Shirt Palo Rosa Lippi,CLP 29.990,https://www.lippioutdoor.com/camisa-mujer-lumberjack-shirt-palo-rosa-lippi-m22.html,mujer,2022-07-27
Zapatilla Mujer Panal III Negro Lippi,CLP 24.990,https://www.lippioutdoor.com/zapatilla-mujer-panal-iii-negro-v21.html,mujer,2022-07-27
Chaqueta Mujer Macaya Softshell Hoody Jacket Melange Azul Lavanda Lippi,CLP 64.990,https://www.lippioutdoor.com/chaqueta-mujer-macaya-softshell-hoody-jacket-melange-azul-lavanda-lippi-m22.html,mujer,2022-07-27
Poleron Mujer Lighter Nano-F 1/4 Zip Arena Lippi,CLP 44.990,https://www.lippioutdoor.com/poleron-mujer-lighter-nano-f-1-4-zip-arena-lippi-m22.html,mujer,2022-07-27
Botin Mujer Puelo CS Hi Grafito Lippi,CLP 74.990,https://www.lippioutdoor.com/4620-botin-mujer-puelo-cs-hi-gr-fito.html,mujer,2022-07-27
Chaqueta Mujer Peumo Canvas Hoody Jacket Negro Lippi,CLP 89.990,https://www.lippioutdoor.com/chaqueta-mujer-peumo-canvas-hoody-jacket-negro-lippi-m22.html,mujer,2022-07-27
Chaqueta Mujer Paicavi Therm-Pro Jacket Azulino Lippi,CLP 43.990,https://www.lippioutdoor.com/chaqueta-mujer-paicavi-therm-pro-jacket-azulino-i21.html,mujer,2022-07-27
Chaqueta Mujer Spry Steam-Pro Jacket Verde Grisaceo Lippi,CLP 69.990,https://www.lippioutdoor.com/chaqueta-mujer-spry-steam-pro-jacket-verde-grisaceo-lippi-m22.html,mujer,2022-07-27
Chaqueta Mujer Nightfall Windbreaker Hoody Jacket Burdeo Lippi,CLP 54.990,https://www.lippioutdoor.com/chaqueta-mujer-nightfall-windbreaker-hoody-jacket-burdeo-lippi-m22.html,mujer,2022-07-27
Chaqueta Mujer Paicavi Therm-Pro 1/4 Zip Jacket Verde Grisaceo Lippi,CLP 39.990,https://www.lippioutdoor.com/chaqueta-mujer-paicavi-therm-pro-1-4-zip-jacket-verde-grisaceo-lippi-m22.html,mujer,2022-07-27
Chaqueta Mujer Alamo Blend-Pro Hoody Jacket Rosa Oscuro Lippi,CLP 47.990,https://www.lippioutdoor.com/chaqueta-mujer-alamo-blend-pro-hoody-jacket-rosa-oscuro-lippi-m22.html,mujer,2022-07-27
Poleron Mujer Jacaranda Nano-F 1/4 Zip Palo Rosa Lippi,CLP 39.990,https://www.lippioutdoor.com/poleron-mujer-jacaranda-nano-f-1-4-zip-palo-rosa-i21.html,mujer,2022-07-27
Chaqueta Mujer Paicavi Therm-Pro 1/4 Zip Jacket Burdeo Lippi,CLP 39.990,https://www.lippioutdoor.com/chaqueta-mujer-paicavi-therm-pro-1-4-zip-jacket-burdeo-lippi-m22.html,mujer,2022-07-27
Chaqueta Mujer Shield B-Dry Hoody Jacket Negro Lippi,CLP 99.990,https://www.lippioutdoor.com/chaqueta-mujer-shield-b-dry-hoody-jacket-negro-lippi-m22.html,mujer,2022-07-27
Botin Mujer All Terra Mid Vino Lippi,CLP 84.990,https://www.lippioutdoor.com/botin-mujer-all-terra-mid-vino-i21.html,mujer,2022-07-27
Pantalon Mujer Dinamic Softshell Pants Gris Oscuro Lippi,CLP 59.990,https://www.lippioutdoor.com/pantalon-mujer-dinamic-softshell-pants-gris-oscuro-lippi-m22.html,mujer,2022-07-27
Poleron Mujer Stripes Nano-F Full Zip Hoody Negro Lippi,CLP 24.990,https://www.lippioutdoor.com/poleron-mujer-stripes-nano-f-full-zip-hoody-negro-i21.html,mujer,2022-07-27
Poleron Mujer Jacaranda Nano-F 1/4 Zip Frambuesa Lippi,CLP 39.990,https://www.lippioutdoor.com/poleron-mujer-jacaranda-nano-f-1-4-zip-frambuesa-i21.html,mujer,2022-07-27
Chaqueta Mujer Cold Place B-Dry Hoody Jacket Celeste Lippi,CLP 99.990,https://www.lippioutdoor.com/chaqueta-mujer-cold-place-b-dry-hoody-jacket-celeste-lippi-m22.html,mujer,2022-07-27
Chaqueta Mujer Peumo Canvas Hoody Jacket Cafe Pardo Lippi,CLP 89.990,https://www.lippioutdoor.com/chaqueta-mujer-peumo-canvas-hoody-jacket-cafe-pardo-lippi-m22.html,mujer,2022-07-27
Chaqueta Mujer Blizzard B-Dry Hoody Jacket Frambuesa Lippi,CLP 89.990,https://www.lippioutdoor.com/chaqueta-mujer-blizzard-b-dry-hoody-jacket-frambuesa-i21.html,mujer,2022-07-27
Chaqueta Mujer Ferret Shaggy-Pro Jacket Negro Lippi,CLP 44.990,https://www.lippioutdoor.com/chaqueta-mujer-ferret-shaggy-pro-jacket-negro-lippi-m22.html,mujer,2022-07-27
Chaqueta Mujer Ferret Shaggy-Pro Jacket Cafe Lippi,CLP 44.990,https://www.lippioutdoor.com/chaqueta-mujer-ferret-shaggy-pro-jacket-cafe-lippi-m22.html,mujer,2022-07-27
Botin Mujer Puelo CS Hi Burdeo Lippi,CLP 74.990,https://www.lippioutdoor.com/4619-botin-mujer-puelo-cs-hi-burdeo.html,mujer,2022-07-27
Chaqueta Mujer Peak Down Hoody Negro I20 Lippi,CLP 99.990,https://www.lippioutdoor.com/8224-chaqueta-mujer-peak-down-hoody-negro-i20.html,mujer,2022-07-27
Chaqueta Mujer Furry Shaggy-Pro Jacket Crudo Lippi,CLP 44.990,https://www.lippioutdoor.com/chaqueta-mujer-furry-shaggy-pro-jacket-crudo-lippi-m22.html,mujer,2022-07-27
Pantalón Mujer Snow Raptor B-Dry Negro I19 Lippi,CLP 74.990,https://www.lippioutdoor.com/8245-pantal-n-mujer-snow-raptor-b-dry-negro-i19.html,mujer,2022-07-27
Chaqueta Mujer Snow Raptor B-Dry Hoody Jade Oscuro I19 Lippi,CLP 79.990,https://www.lippioutdoor.com/8228-chaqueta-mujer-snow-raptor-b-dry-hoody-jade-oscuro-i19.html,mujer,2022-07-27
Bota Mujer Polar Light Azul I20 Lippi,CLP 62.990,https://www.lippioutdoor.com/8318-bota-mujer-polar-light-azul-i20.html,mujer,2022-07-27
Botín Mujer Native Mid Forcegrip Negro I20 Lippi,CLP 69.990,https://www.lippioutdoor.com/8279-bot-n-mujer-native-mid-forcegrip-negro-i20.html,mujer,2022-07-27
Chaqueta Mujer Bear Shaggy-Pro Hoody Jacket Laurel Lippi,CLP 44.990,https://www.lippioutdoor.com/chaqueta-mujer-bear-shaggy-pro-hoody-jacket-laurel-i21.html,mujer,2022-07-27
Polera Deportiva Mujer Core Melange Grafito Lippi,CLP 9.990,https://www.lippioutdoor.com/polera-deportiva-mujer-core-melange-grafito-grafito-v21.html,mujer,2022-07-27
Chaqueta Mujer Shield B-Dry Hoody Jacket Malva Lippi,CLP 99.990,https://www.lippioutdoor.com/chaqueta-mujer-shield-b-dry-hoody-jacket-malva-lippi-m22.html,mujer,2022-07-27
Botin Mujer All Terra Mid Beige Lippi,CLP 84.990,https://www.lippioutdoor.com/botin-mujer-all-terra-mid-beige-i21.html,mujer,2022-07-27
Chaqueta Mujer Blizzard B-Dry Hoody Jacket Grafito Lippi,CLP 89.990,https://www.lippioutdoor.com/chaqueta-mujer-blizzard-b-dry-hoody-jacket-grafito-i21.html,mujer,2022-07-27
Chaqueta Mujer Paicavi Therm-Pro Jacket Crudo Lippi,CLP 43.990,https://www.lippioutdoor.com/chaqueta-mujer-paicavi-therm-pro-jacket-crudo-i21.html,mujer,2022-07-27
Poleron Mujer Lighter Nano-F 1/4 Zip Negro Lippi,CLP 44.990,https://www.lippioutdoor.com/poleron-mujer-lighter-nano-f-1-4-zip-negro-lippi-m22.html,mujer,2022-07-27
Chaqueta Mujer Tres Cruces Fusion-3 Hoody Jacket Verde Grisaceo Lippi,CLP 169.990,https://www.lippioutdoor.com/chaqueta-mujer-tres-cruces-fusion-3-hoody-jacket-verde-grisaceo-lippi-m22.html,mujer,2022-07-27
Pantalón Mujer Snow Raptor B-Dry Verde Grisaceo I19 Lippi,CLP 74.990,https://www.lippioutdoor.com/8246-pantal-n-mujer-snow-raptor-b-dry-verde-grisaceo-i19.html,mujer,2022-07-27
Chaqueta Mujer Bear Shaggy-Pro Hoody Jacket Crudo Lippi,CLP 44.990,https://www.lippioutdoor.com/chaqueta-mujer-bear-shaggy-pro-hoody-jacket-crudo-i21.html,mujer,2022-07-27
Chaqueta Mujer Alamo Blend-Pro Hoody Jacket Gris Medio Lippi,CLP 47.990,https://www.lippioutdoor.com/chaqueta-mujer-alamo-blend-pro-hoody-jacket-gris-medio-lippi-m22.html,mujer,2022-07-27
Chaqueta Mujer Bear Shaggy-Pro Hoody Jacket Negro Lippi,CLP 44.990,https://www.lippioutdoor.com/chaqueta-mujer-bear-shaggy-pro-hoody-jacket-negro-i21.html,mujer,2022-07-27
Chaqueta Mujer Bear Shaggy-Pro Hoody Jacket Burdeo Lippi,CLP 44.990,https://www.lippioutdoor.com/chaqueta-mujer-bear-shaggy-pro-hoody-jacket-burdeo-i21.html,mujer,2022-07-27
Chaqueta Plumas Mujer Peak Down Hoody Turquesa Lippi,CLP 99.990,https://www.lippioutdoor.com/chaqueta-plumas-mujer-peak-down-hoody-turquesa-turquesa-i20.html,mujer,2022-07-27
Chaqueta Mujer Seek Softshell Hoody Jacket Negro Lippi,CLP 49.990,https://www.lippioutdoor.com/chaqueta-mujer-seek-softshell-hoody-jacket-negro-lippi-m22.html,mujer,2022-07-27
Pantalon Mujer Pardo Mix-2 Q-Dry Pants Verde Musgo Lippi,CLP 44.990,https://www.lippioutdoor.com/pantalon-mujer-pardo-mix-2-q-dry-pants-verde-musgo-lippi-m22.html,mujer,2022-07-27
Camisa Mujer Lumberjack Shirt Verde Grisaceo Lippi,CLP 29.990,https://www.lippioutdoor.com/camisa-mujer-lumberjack-shirt-verde-grisaceo-lippi-m22.html,mujer,2022-07-27
Botin Mujer Puelo CS Hi Negro Uva Lippi,CLP 74.990,https://www.lippioutdoor.com/botin-mujer-puelo-cs-hi-negro-uva-i21.html,mujer,2022-07-27
Chaqueta Mujer Nightfall Windbreaker Hoody Jacket Taupe Lippi,CLP 54.990,https://www.lippioutdoor.com/chaqueta-mujer-nightfall-windbreaker-hoody-jacket-taupe-lippi-m22.html,mujer,2022-07-27
Poleron Mujer Jacaranda Nano-F 1/4 Zip Crudo Lippi,CLP 39.990,https://www.lippioutdoor.com/poleron-mujer-jacaranda-nano-f-1-4-zip-crudo-i21.html,mujer,2022-07-27
Chaqueta Mujer Snow Raptor B-Dry Hoody Burdeo I19 Lippi,CLP 79.990,https://www.lippioutdoor.com/8227-chaqueta-mujer-snow-raptor-b-dry-hoody-burdeo-i19.html,mujer,2022-07-27
Poleron Mujer Warmy Sweatshirt Laurel Lippi,CLP 29.990,https://www.lippioutdoor.com/poleron-mujer-warmy-sweatshirt-laurel-lippi-2.html,mujer,2022-07-27
Chaqueta Mujer Alamo Blend-Pro Hoody Jacket Lila Lippi,CLP 47.990,https://www.lippioutdoor.com/chaqueta-mujer-alamo-blend-pro-hoody-jacket-lila-lippi-m22.html,mujer,2022-07-27
Zapatilla Mujer Wool Step City Black Coral Lippi,CLP 34.990,https://www.lippioutdoor.com/zapatilla-mujer-wool-step-city-black-fog-lippi-v22.html,mujer,2022-07-27
Chaqueta Mujer Ultimate Stretch Down Jacket Negro Lippi,CLP 99.990,https://www.lippioutdoor.com/chaqueta-mujer-ultimate-stretch-down-jacket-negro-lippi-m22.html,mujer,2022-07-27
Chaqueta Mujer Ferret Shaggy-Pro Jacket Taupe Lippi,CLP 44.990,https://www.lippioutdoor.com/chaqueta-mujer-ferret-shaggy-pro-jacket-taupe-lippi-m22.html,mujer,2022-07-27
Chaqueta Mujer Blizzard B-Dry Hoody Turquesa Verde I20 Lippi,CLP 89.990,https://www.lippioutdoor.com/7794-chaqueta-mujer-blizzard-b-dry-hoody-turquesa-verde-i20.html,mujer,2022-07-27
Chaqueta Mujer Alamo Blend-Pro Hoody Jacket Verde Grisaceo Lippi,CLP 47.990,https://www.lippioutdoor.com/chaqueta-mujer-alamo-blend-pro-hoody-jacket-verde-grisaceo-lippi-m22.html,mujer,2022-07-27
Chaqueta Mujer Venture Steam-Pro Hoody Jacket Malva Lippi,CLP 89.990,https://www.lippioutdoor.com/chaqueta-mujer-venture-steam-pro-hoody-jacket-malva-lippi-m22.html,mujer,2022-07-27
Botin Mujer Woods Mid Negro Lippi,CLP 109.990,https://www.lippioutdoor.com/4643-botin-mujer-woods-mid-negro.html,mujer,2022-07-27
Chaqueta Mujer Nalca Fusion-3 Hoody Vino I20 Lippi,CLP 199.990,https://www.lippioutdoor.com/7811-chaqueta-mujer-nalca-fusion-3-hoody-vino-i20.html,mujer,2022-07-27
Poleron Mujer Jacaranda Nano-F 1/4 Zip Azul Marino Lippi,CLP 39.990,https://www.lippioutdoor.com/poleron-mujer-jacaranda-nano-f-1-4-zip-azul-marino-i21.html,mujer,2022-07-27
Chaqueta Mujer Ferret Shaggy-Pro Jacket Vino Lippi,CLP 44.990,https://www.lippioutdoor.com/chaqueta-mujer-ferret-shaggy-pro-jacket-vino-lippi-m22.html,mujer,2022-07-27
Botin Mujer Puelo CS Hi Turquesa Lippi,CLP 74.990,https://www.lippioutdoor.com/botin-mujer-puelo-cs-hi-turquesa-i21.html,mujer,2022-07-27
Pantalon Outdoor Mujer Trail Q-Dry Pants Caqui Lippi,CLP 14.990,https://www.lippioutdoor.com/pantalon-outdoor-mujer-trail-q-dry-pants-caqui-caqui-v21.html,mujer,2022-07-27
Chaqueta Mujer Coronado Therm-Pro Jacket Melange Turquesa Lippi,CLP 55.990,https://www.lippioutdoor.com/chaqueta-mujer-coronado-therm-pro-jacket-melange-turquesa-lippi-m22.html,mujer,2022-07-27
Chaqueta Mujer Roble B-Dry Hoody Jacket Negro Lippi,CLP 99.990,https://www.lippioutdoor.com/chaqueta-mujer-roble-b-dry-hoody-jacket-negro-lippi-m22.html,mujer,2022-07-27
Chaqueta Mujer Furry Shaggy-Pro Jacket Burdeo Lippi,CLP 44.990,https://www.lippioutdoor.com/chaqueta-mujer-furry-shaggy-pro-jacket-burdeo-lippi-m22.html,mujer,2022-07-27
Zapatilla Mujer Vulcano Shell Stone Bdry Turquoise Grey Lippi,CLP 74.990,https://www.lippioutdoor.com/zapatilla-mujer-vulcano-shell-stone-bdry-turquoise-grey-i21.html,mujer,2022-07-27
Zapatilla Mujer Vulcano Moon Stone Turquoise Grey Lippi,CLP 54.990,https://www.lippioutdoor.com/zapatilla-mujer-vulcano-moon-stone-turquoise-grey-i21.html,mujer,2022-07-27
Chaquetas Mujer Roble B-Dry Hoody Jacket Negro Lippi,CLP 79.990,https://www.lippioutdoor.com/chaquetas-mujer-roble-b-dry-hoody-jacket-negro-lippi-v22.html,mujer,2022-07-27
Botín Mujer Slate B-Dry Coral,CLP 64.990,https://www.lippioutdoor.com/botin-mujer-slate-b-dry-coral-v22.html,mujer,2022-07-27
Zapatilla Mujer Panal III Verde Claro Lippi,CLP 24.990,https://www.lippioutdoor.com/zapatilla-mujer-panal-iii-verde-claro-v21.html,mujer,2022-07-27
Chaqueta Mujer Coronado Therm-Pro Jacket Melange Vino Lippi,CLP 55.990,https://www.lippioutdoor.com/chaqueta-mujer-coronado-therm-pro-jacket-melange-vino-lippi-m22.html,mujer,2022-07-27
Chaqueta Mujer Paicavi Therm-Pro 1/4 Zip Jacket Negro Lippi,CLP 39.990,https://www.lippioutdoor.com/chaqueta-mujer-paicavi-therm-pro-1-4-zip-jacket-negro-lippi-m22.html,mujer,2022-07-27
Chaqueta Mujer Shield B-Dry Hoody Jacket Burdeo Lippi,CLP 99.990,https://www.lippioutdoor.com/chaqueta-mujer-shield-b-dry-hoody-jacket-burdeo-lippi-m22.html,mujer,2022-07-27
Primera Capa Mujer Skintec 3000 Top Burdeo Lippi,CLP 49.990,https://www.lippioutdoor.com/primera-capa-mujer-skintec-3000-top-burdeo-lippi-m22.html,mujer,2022-07-27
Chaqueta Mujer Sense Blend-Pro Jacket Melange Blue Lippi,CLP 47.990,https://www.lippioutdoor.com/chaqueta-mujer-sense-blend-pro-jacket-melange-blue-lippi-m22.html,mujer,2022-07-27
Zapatilla Mujer Vulcano Moon Stone Coral Rose Lippi,CLP 54.990,https://www.lippioutdoor.com/zapatilla-mujer-vulcano-moon-stone-coral-rose-i21.html,mujer,2022-07-27
Chaqueta Mujer Numan Shaggy-Pro Jacket Malva Lippi,CLP 39.990,https://www.lippioutdoor.com/chaqueta-mujer-numan-shaggy-pro-jacket-malva-lippi-m22.html,mujer,2022-07-27
Zapatilla Mujer Vulcano Iron Stone Mid Bdry Dark Rose Lippi,CLP 89.990,https://www.lippioutdoor.com/zapatilla-mujer-vulcano-iron-stone-mid-bdry-dark-rose-lippi-v22.html,mujer,2022-07-27
Botin Mujer Puelo CS Hi Gris Lippi,CLP 74.990,https://www.lippioutdoor.com/botin-mujer-puelo-cs-hi-gris-i15.html,mujer,2022-07-27
Poleron Mujer Warmy Sweatshirt Jade Lippi,CLP 29.990,https://www.lippioutdoor.com/poleron-mujer-warmy-sweatshirt-jade-lippi-1.html,mujer,2022-07-27
Chaqueta Mujer Spry Steam-Pro Jacket Grafito,CLP 94.990,https://www.lippioutdoor.com/chaqueta-mujer-spry-steam-pro-jacket-grafito-v22.html,mujer,2022-07-27
Chaqueta Mujer Tres Cruces Fusion-3 Hoody Jacket Vino Lippi,CLP 169.990,https://www.lippioutdoor.com/chaqueta-mujer-tres-cruces-fusion-3-hoody-jacket-vino-lippi-m22.html,mujer,2022-07-27
Chaqueta Mujer Tres Cruces Fusion-3 Hoody Jacket Azul Oscuro Lippi,CLP 169.990,https://www.lippioutdoor.com/chaqueta-mujer-tres-cruces-fusion-3-hoody-jacket-azul-oscuro-lippi-m22.html,mujer,2022-07-27
Chaqueta Mujer Sense Blend-Pro Hoody Jacket Melange Negro,CLP 38.990,https://www.lippioutdoor.com/chaqueta-mujer-sense-blend-pro-hoody-jacket-melange-negro-v22.html,mujer,2022-07-27
Chaqueta Mujer Long Line Steam-Pro Hoody Jacket Verde Musgo Lippi,CLP 99.990,https://www.lippioutdoor.com/chaqueta-mujer-long-line-steam-pro-hoody-jacket-verde-musgo-lippi-m22.html,mujer,2022-07-27
Chaqueta Mujer Nightfall WindBreaker Hoody Jacket Negro Lippi,CLP 54.990,https://www.lippioutdoor.com/chaqueta-mujer-nightfall-windbreaker-hoody-jacket-negro-v22.html,mujer,2022-07-27
Chaqueta Mujer Peak Down Hoody Uva I20 Lippi,CLP 99.990,https://www.lippioutdoor.com/8225-chaqueta-mujer-peak-down-hoody-uva-i20.html,mujer,2022-07-27
Chaqueta Mujer Sense Blend-Pro Jacket Melange Vino Lippi,CLP 47.990,https://www.lippioutdoor.com/chaqueta-mujer-sense-blend-pro-jacket-melange-vino-lippi-m22.html,mujer,2022-07-27
Chaqueta Mujer Velvet Blend-Pro Jacket Melange Vino Lippi,CLP 24.990,https://www.lippioutdoor.com/chaqueta-mujer-velvet-blend-pro-jacket-melange-vino-i21.html,mujer,2022-07-27
Zapatilla Mujer Vulcano Iron Stone Bdry Black Aqua Lippi,CLP 74.990,https://www.lippioutdoor.com/zapatilla-mujer-vulcano-iron-stone-bdry-black-aqua-i21.html,mujer,2022-07-27
Chaqueta Mujer Alpine B-Dry Hoody Jacket Negro Lippi,CLP 89.990,https://www.lippioutdoor.com/chaqueta-mujer-alpine-b-dry-hoody-jacket-negro-lippi-m22.html,mujer,2022-07-27
Zapatilla Mujer Wool Step Slip On Triple Black Lippi,CLP 29.990,https://www.lippioutdoor.com/zapatilla-mujer-wool-step-slip-on-triple-black-lippi-v22.html,mujer,2022-07-27
Zapatilla Mujer 4River Jade Lippi,CLP 19.990,https://www.lippioutdoor.com/zapatilla-mujer-4river-jade-v20.html,mujer,2022-07-27
Zapatilla Mujer Wool Step City Rose Lippi,CLP 34.990,https://www.lippioutdoor.com/zapatilla-mujer-wool-step-city-rose-lippi-v22.html,mujer,2022-07-27
Zapatilla Mujer Vulcano Iron Stone Grape Lippi,CLP 54.990,https://www.lippioutdoor.com/zapatilla-mujer-vulcano-iron-stone-grape-i21.html,mujer,2022-07-27
Polera Mujer Core Q-Dry T-Shirt Lila Lippi,CLP 9.990,https://www.lippioutdoor.com/polera-mujer-core-q-dry-t-shirt-lila-v22.html,mujer,2022-07-27
Short Mujer Fury Shorts Grafito,CLP 24.990,https://www.lippioutdoor.com/short-mujer-fury-shorts-grafito-v22.html,mujer,2022-07-27
Calza Mujer In-Action Trekking Leggings Azul Noche Lippi,CLP 32.990,https://www.lippioutdoor.com/calza-mujer-in-action-trekking-leggings-azul-noche-lippi-m22.html,mujer,2022-07-27
Chaqueta Mujer Bazpur Down Hoody Burdeo I19 Lippi,CLP 99.990,https://www.lippioutdoor.com/8220-chaqueta-mujer-bazpur-down-hoody-burdeo-i19.html,mujer,2022-07-27
Poleron Mujer Jacaranda Nano-F 1/4 Zip Hoody Frambuesa Lippi,CLP 42.990,https://www.lippioutdoor.com/poleron-mujer-jacaranda-nano-f-1-4-zip-hoody-frambuesa-i21.html,mujer,2022-07-27
Poleron Mujer Stripes Nano-F Full Zip Hoody Crudo Lippi,CLP 29.990,https://www.lippioutdoor.com/poleron-mujer-stripes-nano-f-full-zip-hoody-crudo-i21.html,mujer,2022-07-27
Chaqueta Mujer Spry Steam-Pro Jacket Frambuesa Lippi,CLP 69.990,https://www.lippioutdoor.com/chaqueta-mujer-spry-steam-pro-jacket-frambuesa-lippi-m22.html,mujer,2022-07-27
Poleron Mujer Jacaranda Nano-F 1/4 Zip Hoody Azul Marino Lippi,CLP 42.990,https://www.lippioutdoor.com/poleron-mujer-jacaranda-nano-f-1-4-zip-hoody-azul-marino-i21.html,mujer,2022-07-27
Poleron Mujer Jacaranda Nano-F 1/4 Zip Hoody Print Palo Rosa Lippi,CLP 42.990,https://www.lippioutdoor.com/poleron-mujer-jacaranda-nano-f-1-4-zip-hoody-print-palo-rosa-lippi-m22.html,mujer,2022-07-27
Zapatilla Mujer Panal III Burdeo Lippi,CLP 21.990,https://www.lippioutdoor.com/zapatilla-mujer-panal-iii-burdeo-v21.html,mujer,2022-07-27
Zapatilla Mujer Panal III Jade Lippi,CLP 24.990,https://www.lippioutdoor.com/zapatilla-mujer-panal-iii-jade-v21.html,mujer,2022-07-27
Short Mujer Fury Shorts Negro,CLP 24.990,https://www.lippioutdoor.com/short-mujer-fury-shorts-negro-v22.html,mujer,2022-07-27
Short Mujer Go For It Shorts Negro,CLP 12.990,https://www.lippioutdoor.com/short-mujer-go-for-it-shorts-negro-v22.html,mujer,2022-07-27
Chaqueta Mujer Sense Blend-Pro Jacket Melange Laurel Lippi,CLP 47.990,https://www.lippioutdoor.com/chaqueta-mujer-sense-blend-pro-jacket-melange-laurel-lippi-m22.html,mujer,2022-07-27
Chaqueta Mujer Spry Steam-Pro Hoody Jacket Grafito,CLP 109.990,https://www.lippioutdoor.com/chaqueta-mujer-spry-steam-pro-hoody-jacket-grafito-v22.html,mujer,2022-07-27
