nombre producto,precio,link,categoria,fecha
Poleron Mujer Haka Honu Del Sur Negro,CLP 79.990,https://www.lippioutdoor.com/poleron-mujer-del-sur-negro-v22.html,mujer,2022-07-27
Poleron Mujer Haka Honu Tokerau Pro Gris,CLP 34.990,https://www.lippioutdoor.com/poleron-mujer-tokerau-pro-gris-i21.html,mujer,2022-07-27
Botin Mujer Haka Honu Pampa Negro,CLP 74.990,https://www.lippioutdoor.com/botin-mujer-pampa-negro-v22.html,mujer,2022-07-27
Pantalon Mujer Moke Burdeo Haka Honu,CLP 69.990,https://www.lippioutdoor.com/pantalon-mujer-moke-burdeo-haka-honu-m22.html,mujer,2022-07-27
Sandalia Mujer Haka Honu Shalaila Negro Blanco,CLP 8.990,https://www.lippioutdoor.com/sandalia-mujer-shalaila-negro-blanco-v21.html,mujer,2022-07-27
Short Mujer Haka Honu Shortiza Damasco,CLP 16.990,https://www.lippioutdoor.com/short-mujer-shortiza-damasco-v22.html,mujer,2022-07-27
Polera Mujer Haka Honu Sudala Damasco,CLP 12.490,https://www.lippioutdoor.com/polera-mujer-sudala-damasco-v22.html,mujer,2022-07-27
Poleron Mujer Taina Nui Negro Haka Honu,CLP 29.990,https://www.lippioutdoor.com/poleron-mujer-taina-nui-negro-haka-honu-m22.html,mujer,2022-07-27
Primera capa Mujer Huemul top Print Celeste Haka Honu,CLP 29.990,https://www.lippioutdoor.com/primera-capa-mujer-huemul-top-print-celeste-haka-honu-m22.html,mujer,2022-07-27
Poleron Mujer Haka Honu Tio Emiliodon Negro,CLP 43.990,https://www.lippioutdoor.com/poleron-mujer-tio-emiliodon-negro-v22.html,mujer,2022-07-27
Poleron Mujer Vest-ir Negro Haka Honu,CLP 49.990,https://www.lippioutdoor.com/poleron-mujer-vest-ir-negro-haka-honu-m22.html,mujer,2022-07-27
Pantalon Mujer Jeans con gin Negro Haka Honu,CLP 49.990,https://www.lippioutdoor.com/pantalon-mujer-jeans-con-gin-negro-haka-honu-m22.html,mujer,2022-07-27
Sandalia Mujer Haka Honu Shalaila Negro,CLP 8.990,https://www.lippioutdoor.com/sandalia-mujer-shalaila-negro-v21.html,mujer,2022-07-27
Chaleco Mujer Sureño Mostaza Haka Honu,CLP 69.990,https://www.lippioutdoor.com/chaleco-mujer-sureno-mostaza-haka-honu-m22.html,mujer,2022-07-27
Chaqueta Mujer Bi-polar Crudo Haka Honu,CLP 62.990,https://www.lippioutdoor.com/chaqueta-mujer-bi-polar-crudo-haka-honu-m22.html,mujer,2022-07-27
Chaqueta Mujer Caluro-sin Vino Haka Honu,CLP 41.990,https://www.lippioutdoor.com/chaqueta-mujer-caluro-sin-vino-haka-honu-m22.html,mujer,2022-07-27
Zapatilla Mujer Haka Honu Aloha Mostaza,CLP 19.990,https://www.lippioutdoor.com/zapatilla-mujer-aloha-mostaza.html,mujer,2022-07-27
Poleron Mujer Haka Honu Ninja Negro,CLP 27.990,https://www.lippioutdoor.com/poleron-mujer-ninja-negro-v22.html,mujer,2022-07-27
Poleron Mujer Haka Honu Tio Emiliodon Damasco,CLP 43.990,https://www.lippioutdoor.com/poleron-mujer-tio-emiliodon-damasco-v22.html,mujer,2022-07-27
Polera Mujer Haka Honu Polo Beige,CLP 9.990,https://www.lippioutdoor.com/polera-mujer-polo-beige-v22.html,mujer,2022-07-27
Calza Mujer Pampa Negro Haka Honu,CLP 34.990,https://www.lippioutdoor.com/calza-mujer-pampa-negro-haka-honu-m22.html,mujer,2022-07-27
Poleron Mujer Haka Honu Tokerau Negro,CLP 32.990,https://www.lippioutdoor.com/poleron-mujer-tokerau-negro-i21.html,mujer,2022-07-27
Poleron Mujer Tokerau Negro Haka Honu,CLP 32.990,https://www.lippioutdoor.com/poleron-mujer-tokerau-negro-haka-honu-m22.html,mujer,2022-07-27
Vestido Mujer Haka Honu Aflora Terracota,CLP 14.990,https://www.lippioutdoor.com/vestido-mujer-aflora-terracota-v22.html,mujer,2022-07-27
Chaqueta Mujer Haka Honu Aperrao Verde militar,CLP 32.990,https://www.lippioutdoor.com/chaqueta-mujer-aperrao-verde-militar-v22.html,mujer,2022-07-27
Traje de baño Mujer Haka Honu Sirena Amarillo,CLP 16.990,https://www.lippioutdoor.com/traje-de-bano-mujer-sirena-amarillo-v22.html,mujer,2022-07-27
Polera Mujer Haka Honu Sudala Negro,CLP 12.490,https://www.lippioutdoor.com/polera-mujer-sudala-negro-v22.html,mujer,2022-07-27
Chaqueta Mujer Calur-oso Beige Haka Honu,CLP 44.990,https://www.lippioutdoor.com/chaqueta-mujer-calur-oso-beige-haka-honu-m22.html,mujer,2022-07-27
Poleron Mujer Haka Honu Del Sur Coral,CLP 79.990,https://www.lippioutdoor.com/poleron-mujer-del-sur-coral-v22.html,mujer,2022-07-27
Chaqueta Mujer Haka Honu James Jeans Negra,CLP 35.990,https://www.lippioutdoor.com/chaqueta-mujer-james-jeans-negra-v22.html,mujer,2022-07-27
Poleron Mujer Haka Honu Tokerau Pro Negro,CLP 34.990,https://www.lippioutdoor.com/poleron-mujer-tokerau-pro-negro-i21.html,mujer,2022-07-27
Polera Mujer Haka Honu Sudala Mostaza,CLP 12.490,https://www.lippioutdoor.com/polera-mujer-sudala-mostaza-v22.html,mujer,2022-07-27
Polera Mujer Haka Honu Polo Burdeo,CLP 9.990,https://www.lippioutdoor.com/polera-mujer-polo-burdeo-v22.html,mujer,2022-07-27
Peto Mujer Haka Honu Loica Negro,CLP 16.990,https://www.lippioutdoor.com/peto-mujer-loica-negro-v22.html,mujer,2022-07-27
Chaqueta Mujer Haka Honu James Jeans Celeste,CLP 35.990,https://www.lippioutdoor.com/chaqueta-mujer-james-jeans-celeste-v22.html,mujer,2022-07-27
Peto Mujer Haka Honu Loica Burdeo,CLP 16.990,https://www.lippioutdoor.com/peto-mujer-loica-burdeo-v22.html,mujer,2022-07-27
Pantalon Mujer Haka Honu Desmontalo Negro,CLP 59.990,https://www.lippioutdoor.com/pantalon-mujer-desmontalo-negro-v22.html,mujer,2022-07-27
Traje de baño Mujer Haka Honu Fondo de bikini Print beige,CLP 12.990,https://www.lippioutdoor.com/traje-de-bano-mujer-fondo-de-bikini-print-beige-v22.html,mujer,2022-07-27
Chaqueta Mujer Caluro-sin Negro Haka Honu,CLP 41.990,https://www.lippioutdoor.com/chaqueta-mujer-caluro-sin-negro-haka-honu-m22.html,mujer,2022-07-27
Traje de baño Mujer Haka Honu Sirena Verde,CLP 16.990,https://www.lippioutdoor.com/traje-de-bano-mujer-sirena-verde-v22.html,mujer,2022-07-27
Traje de baño Mujer Haka Honu La Anderson Burdeo,CLP 10.990,https://www.lippioutdoor.com/traje-de-bano-mujer-la-anderson-burdeo-v22.html,mujer,2022-07-27
Chaqueta Mujer Calur-oso Print Terracota Haka Honu,CLP 44.990,https://www.lippioutdoor.com/chaqueta-mujer-calur-oso-print-terracota-haka-honu-m22.html,mujer,2022-07-27
Chaqueta Mujer Calur-oso Print Burdeo Haka Honu,CLP 44.990,https://www.lippioutdoor.com/chaqueta-mujer-calur-oso-print-burdeo-haka-honu-m22.html,mujer,2022-07-27
Poleron Mujer Haka Honu Emiliodon Negro,CLP 41.990,https://www.lippioutdoor.com/poleron-mujer-emiliodon-negro-v22.html,mujer,2022-07-27
Chaqueta Mujer Haka Honu Brisa Negro,CLP 69.990,https://www.lippioutdoor.com/chaqueta-mujer-brisa-negro-v22.html,mujer,2022-07-27
Polera Mujer Haka Honu Sudala Beige print,CLP 12.490,https://www.lippioutdoor.com/polera-mujer-sudala-beige-print-v22.html,mujer,2022-07-27
Pantalon Mujer Desmontalo Verde Haka Honu,CLP 59.990,https://www.lippioutdoor.com/pantalon-mujer-desmontalo-verde-haka-honu-m22.html,mujer,2022-07-27
Poleron Mujer Del Sur Palo Rosa Haka Honu,CLP 79.990,https://www.lippioutdoor.com/poleron-mujer-del-sur-palo-rosa-haka-honu-m22.html,mujer,2022-07-27
Poleron Mujer Haka Honu Peliculyon Negro,CLP 22.990,https://www.lippioutdoor.com/poleron-mujer-peliculyon-negro-v22.html,mujer,2022-07-27
Poleron Mujer Haka Honu Polaroid Cafe,CLP 43.990,https://www.lippioutdoor.com/poleron-mujer-polaroid-cafe-v22.html,mujer,2022-07-27
Chaqueta Mujer Haka Honu Brisa Burdeo,CLP 69.990,https://www.lippioutdoor.com/chaqueta-mujer-brisa-burdeo-v22.html,mujer,2022-07-27
Polera Mujer Haka Honu Mamboo Jade,CLP 11.490,https://www.lippioutdoor.com/polera-mujer-mamboo-jade-v22.html,mujer,2022-07-27
Poleron Mujer Taina Nui Crudo Haka Honu,CLP 29.990,https://www.lippioutdoor.com/poleron-mujer-taina-nui-crudo-haka-honu-m22.html,mujer,2022-07-27
Poleron Mujer Haka Honu Tokerau Beige,CLP 32.990,https://www.lippioutdoor.com/poleron-mujer-tokerau-beige-i21.html,mujer,2022-07-27
Poleron Mujer Tokerau Beige Haka Honu,CLP 32.990,https://www.lippioutdoor.com/poleron-mujer-tokerau-beige-haka-honu-m22.html,mujer,2022-07-27
Traje de Haka Honu baño Mujer La Anderson Azul,CLP 10.990,https://www.lippioutdoor.com/traje-de-ba-o-mujer-la-anderson-azul-v21.html,mujer,2022-07-27
Traje de Haka Honu Baño Mujer LA ANDERSON CELESTE,CLP 9.990,https://www.lippioutdoor.com/traje-de-ba-o-mujer-la-anderson-celeste-v19.html,mujer,2022-07-27
Peto Mujer Haka Honu Petalo Verde Militar,CLP 16.990,https://www.lippioutdoor.com/peto-mujer-petalo-verde-militar-v22.html,mujer,2022-07-27
Calza Mujer Haka Honu Liebre Verde Militar,CLP 11.990,https://www.lippioutdoor.com/calza-mujer-liebre-verde-militar-v22.html,mujer,2022-07-27
Alpargata Mujer Marea Alta Arena Haka Honu,CLP 44.990,https://www.lippioutdoor.com/alpargata-mujer-marea-alta-arena-haka-honu-v22.html,mujer,2022-07-27
Alpargata Mujer Marea Alta Sandía Haka Honu,CLP 44.990,https://www.lippioutdoor.com/alpargata-mujer-marea-alta-sandia-haka-honu-v22.html,mujer,2022-07-27
Alpargata Unisex Marea Baja Limón Haka Honu,CLP 39.990,https://www.lippioutdoor.com/alpargata-unisex-marea-baja-limon-haka-honu-v22.html,mujer,2022-07-27
Alpargata Unisex Marea Baja Beige Haka Honu,CLP 39.990,https://www.lippioutdoor.com/alpargata-unisex-marea-baja-beige-haka-honu-v22.html,mujer,2022-07-27
Alpargata Unisex Marea Baja Negro Haka Honu,CLP 39.990,https://www.lippioutdoor.com/alpargata-unisex-marea-baja-negro-haka-honu-v22.html,mujer,2022-07-27
Alpargata Mujer Marea Baja Arena Haka Honu,CLP 39.990,https://www.lippioutdoor.com/alpargata-mujer-marea-baja-arena-haka-honu-v22.html,mujer,2022-07-27
Alpargata Mujer Marea Baja Sandía Haka Honu,CLP 39.990,https://www.lippioutdoor.com/alpargata-mujer-marea-baja-sandia-haka-honu-v22.html,mujer,2022-07-27
Botin Mujer Terray Mid Gris Coral Lippi,CLP 99.990,https://www.lippioutdoor.com/botin-mujer-terray-mid-gris-coral-i21.html,mujer,2022-07-27
Botin Mujer Terray Mid Café Turquesa Lippi,CLP 99.990,https://www.lippioutdoor.com/botin-mujer-terray-mid-cafe-turquesa-i21.html,mujer,2022-07-27
Botas de Agua Mujer Camperita Verde Haka Honu,CLP 24.990,https://www.lippioutdoor.com/botas-de-agua-mujer-camperita-verde-haka-honu-f22.html,mujer,2022-07-27
Botas de Agua Mujer Camperita Negro Haka Honu,CLP 24.990,https://www.lippioutdoor.com/botas-de-agua-mujer-camperita-negro-haka-honu-f22.html,mujer,2022-07-27
Botas de Agua Mujer Camperita Caramelo Haka Honu,CLP 24.990,https://www.lippioutdoor.com/botas-de-agua-mujer-camperita-caramelo-haka-honu-f22.html,mujer,2022-07-27
Alpargata Unisex Marea Baja Limón Haka Honu,CLP 39.990,https://www.lippioutdoor.com/alpargata-unisex-marea-baja-limon-haka-honu-v22.html,mujer,2022-07-27
Alpargata Unisex Marea Baja Beige Haka Honu,CLP 39.990,https://www.lippioutdoor.com/alpargata-unisex-marea-baja-beige-haka-honu-v22.html,mujer,2022-07-27
Alpargata Unisex Marea Baja Negro Haka Honu,CLP 39.990,https://www.lippioutdoor.com/alpargata-unisex-marea-baja-negro-haka-honu-v22.html,mujer,2022-07-27
Alpargata Mujer Marea Baja Arena Haka Honu,CLP 39.990,https://www.lippioutdoor.com/alpargata-mujer-marea-baja-arena-haka-honu-v22.html,mujer,2022-07-27
Alpargata Mujer Marea Baja Sandía Haka Honu,CLP 39.990,https://www.lippioutdoor.com/alpargata-mujer-marea-baja-sandia-haka-honu-v22.html,mujer,2022-07-27
Botin Mujer Terray Mid Gris Coral Lippi,CLP 99.990,https://www.lippioutdoor.com/botin-mujer-terray-mid-gris-coral-i21.html,mujer,2022-07-27
Botin Mujer Terray Mid Café Turquesa Lippi,CLP 99.990,https://www.lippioutdoor.com/botin-mujer-terray-mid-cafe-turquesa-i21.html,mujer,2022-07-27
Botas de Agua Mujer Camperita Verde Haka Honu,CLP 24.990,https://www.lippioutdoor.com/botas-de-agua-mujer-camperita-verde-haka-honu-f22.html,mujer,2022-07-27
Botas de Agua Mujer Camperita Negro Haka Honu,CLP 24.990,https://www.lippioutdoor.com/botas-de-agua-mujer-camperita-negro-haka-honu-f22.html,mujer,2022-07-27
Botas de Agua Mujer Camperita Caramelo Haka Honu,CLP 24.990,https://www.lippioutdoor.com/botas-de-agua-mujer-camperita-caramelo-haka-honu-f22.html,mujer,2022-07-27
Botín Mujer Tellus Mid Índigo Oscuro Lippi,CLP 69.990,https://www.lippioutdoor.com/botin-mujer-tellus-mid-indigo-oscuro-lippi-m22.html,mujer,2022-07-27
Botín Mujer Tellus Mid Uva Oscuro Lippi,CLP 69.990,https://www.lippioutdoor.com/botin-mujer-tellus-mid-uva-oscuro-lippi-m22.html,mujer,2022-07-27
Botín Mujer Tellus Mid Rosa Oscuro Lippi,CLP 69.990,https://www.lippioutdoor.com/botin-mujer-tellus-mid-rosa-oscuro-lippi-m22.html,mujer,2022-07-27
Botín Mujer Tellus Mid Acero Oscuro Lippi,CLP 69.990,https://www.lippioutdoor.com/botin-mujer-tellus-mid-acero-oscuro-lippi-m22.html,mujer,2022-07-27
Botín Mujer Tellus Mid Gris Verde Lippi,CLP 69.990,https://www.lippioutdoor.com/botin-mujer-tellus-mid-gris-verde-lippi-m22.html,mujer,2022-07-27
Zapatilla Mujer Wool Step Insulate Olive Lippi,CLP 29.990,https://www.lippioutdoor.com/zapatilla-mujer-wool-step-insulate-olive-lippi-v22.html,mujer,2022-07-27
Zapatilla Mujer Wool Step Insulate Triple Black Lippi,CLP 29.990,https://www.lippioutdoor.com/zapatilla-mujer-wool-step-insulate-triple-black-lippi-v22.html,mujer,2022-07-27
Botin Mujer Light Rock Mid II Purpura Lippi,CLP 99.990,https://www.lippioutdoor.com/botin-mujer-light-rock-mid-ii-purpura-i21.html,mujer,2022-07-27
Botin Mujer Light Rock Mid II Turquesa Lippi,CLP 99.990,https://www.lippioutdoor.com/botin-mujer-light-rock-mid-ii-turquesa-i21.html,mujer,2022-07-27
Botin Mujer Light Rock Mid II Rosa Lippi,CLP 99.990,https://www.lippioutdoor.com/botin-mujer-light-rock-mid-ii-rosa-i21.html,mujer,2022-07-27
Zapatilla Mujer Vulcano Iron Stone Bdry Dark Rose Lippi,CLP 74.990,https://www.lippioutdoor.com/zapatilla-mujer-vulcano-iron-stone-bdry-coral-pink-i21.html,mujer,2022-07-27
Zapatilla Mujer Vulcano Iron Stone Mid Bdry Grey Green Lippi,CLP 89.990,https://www.lippioutdoor.com/zapatilla-mujer-vulcano-iron-stone-mid-bdry-grey-green-lippi-v22.html,mujer,2022-07-27
Botín Mujer Tellus Low Acero Oscuro Lippi,CLP 64.990,https://www.lippioutdoor.com/botin-mujer-tellus-low-acero-oscuro-lippi-m22.html,mujer,2022-07-27
Botín Mujer Tellus Low Uva Oscuro Lippi,CLP 64.990,https://www.lippioutdoor.com/botin-mujer-tellus-low-uva-oscuro-lippi-m22.html,mujer,2022-07-27
Botín Mujer Tellus Low Rosa Oscuro Lippi,CLP 64.990,https://www.lippioutdoor.com/botin-mujer-tellus-low-rosa-oscuro-lippi-m22.html,mujer,2022-07-27
Botín Mujer Tellus Low Indigo Oscuro Lippi,CLP 64.990,https://www.lippioutdoor.com/botin-mujer-tellus-low-indigo-oscuro-lippi-m22.html,mujer,2022-07-27
Bota Mujer Pellón Café Haka Honu,CLP 59.990,https://www.lippioutdoor.com/bota-mujer-pellon-cafe-haka-honu-f22.html,mujer,2022-07-27
Bota Mujer Pellón Mostaza Haka Honu,CLP 59.990,https://www.lippioutdoor.com/bota-mujer-pellon-mostaza-haka-honu-f22.html,mujer,2022-07-27
Bota Mujer Pellón Burdeo Haka Honu,CLP 59.990,https://www.lippioutdoor.com/bota-mujer-pellon-burdeo-haka-honu-f22.html,mujer,2022-07-27
Bota Mujer Pellón Gris Haka Honu,CLP 59.990,https://www.lippioutdoor.com/bota-mujer-pellon-gris-haka-honu-f22.html,mujer,2022-07-27
Poleron Mujer Ninja Negro Haka Honu,CLP 36.990,https://www.lippioutdoor.com/poleron-mujer-ninja-negro-haka-honu-m22.html,mujer,2022-07-27
Poleron Mujer Ninja Verde Haka Honu,CLP 36.990,https://www.lippioutdoor.com/poleron-mujer-ninja-verde-haka-honu-m22.html,mujer,2022-07-27
Poleron Mujer Ninja Violeta Haka Honu,CLP 36.990,https://www.lippioutdoor.com/poleron-mujer-ninja-violeta-haka-honu-m22.html,mujer,2022-07-27
Chaqueta Mujer Valley Sherpa-Pro Jacket Arena Lippi,CLP 34.990,https://www.lippioutdoor.com/chaqueta-mujer-valley-sherpa-pro-jacket-arena-lippi-m22.html,mujer,2022-07-27
Chaqueta Mujer Valley Sherpa-Pro Jacket Laurel Lippi,CLP 34.990,https://www.lippioutdoor.com/chaqueta-mujer-valley-sherpa-pro-jacket-laurel-lippi-m22.html,mujer,2022-07-27
Chaqueta Mujer Valley Sherpa-Pro Jacket Negro Lippi,CLP 34.990,https://www.lippioutdoor.com/chaqueta-mujer-valley-sherpa-pro-jacket-negro-lippi-m22.html,mujer,2022-07-27
Poleron Mujer Jacaranda Nano-F 1/4 Zip Print Palo Rosa Lippi,CLP 39.990,https://www.lippioutdoor.com/poleron-mujer-jacaranda-nano-f-1-4-zip-print-palo-rosa-lippi-m22.html,mujer,2022-07-27
Poleron Mujer Jacaranda Nano-F 1/4 Zip Print Jade Oscuro Lippi,CLP 39.990,https://www.lippioutdoor.com/poleron-mujer-jacaranda-nano-f-1-4-zip-print-jade-oscuro-lippi-m22.html,mujer,2022-07-27
Chaqueta Mujer Joplin Azul Haka Honu,CLP 55.990,https://www.lippioutdoor.com/chaqueta-mujer-joplin-azul-haka-honu-m22.html,mujer,2022-07-27
Chaqueta Mujer Joplin Celeste Haka Honu,CLP 55.990,https://www.lippioutdoor.com/chaqueta-mujer-joplin-celeste-haka-honu-m22.html,mujer,2022-07-27
Chaqueta Mujer Puihua Negro Haka Honu,CLP 63.990,https://www.lippioutdoor.com/chaqueta-mujer-puihua-negro-haka-honu-m22.html,mujer,2022-07-27
Chaqueta Mujer Puihua Verde Haka Honu,CLP 63.990,https://www.lippioutdoor.com/chaqueta-mujer-puihua-verde-haka-honu-m22.html,mujer,2022-07-27
Poleron Mujer Hoodini Negro Haka Honu,CLP 52.990,https://www.lippioutdoor.com/poleron-mujer-hoodini-negro-haka-honu-m22.html,mujer,2022-07-27
Poleron Mujer Hoodini Palo Rosa Haka Honu,CLP 52.990,https://www.lippioutdoor.com/poleron-mujer-hoodini-palo-rosa-haka-honu-m22.html,mujer,2022-07-27
Poleron Mujer Chi-porrito Palo Rosa Haka Honu,CLP 48.990,https://www.lippioutdoor.com/poleron-mujer-chi-porrito-palo-rosa-haka-honu-m22.html,mujer,2022-07-27
Poleron Mujer Chi-porrito Full print Haka Honu,CLP 48.990,https://www.lippioutdoor.com/poleron-mujer-chi-porrito-full-print-haka-honu-m22.html,mujer,2022-07-27
Chaqueta Mujer Cold Place B-Dry Hoody Jacket Laurel Lippi,CLP 99.990,https://www.lippioutdoor.com/chaqueta-mujer-cold-place-b-dry-hoody-jacket-laurel-lippi-m22.html,mujer,2022-07-27
Chaqueta Mujer Cold Place B-Dry Hoody Jacket Vino Lippi,CLP 99.990,https://www.lippioutdoor.com/chaqueta-mujer-cold-place-b-dry-hoody-jacket-vino-lippi-m22.html,mujer,2022-07-27
Camisa Mujer Camanchaca Beige Haka Honu,CLP 39.990,https://www.lippioutdoor.com/camisa-mujer-camanchaca-beige-haka-honu-m22.html,mujer,2022-07-27
Camisa Mujer Camanchaca Palo Rosa Haka Honu,CLP 39.990,https://www.lippioutdoor.com/camisa-mujer-camanchaca-palo-rosa-haka-honu-m22.html,mujer,2022-07-27
Polera Mujer Simetría Hippie Celeste Haka Honu,CLP 14.990,https://www.lippioutdoor.com/polera-mujer-simetria-hippie-celeste-haka-honu-m22.html,mujer,2022-07-27
Poleron Mujer Taina Print Rosado Haka Honu,CLP 29.990,https://www.lippioutdoor.com/poleron-mujer-taina-print-azul-haka-honu-m22.html,mujer,2022-07-27
Chaqueta Mujer Brisk Shaggy-Pro Jacket Beige Lippi,CLP 43.990,https://www.lippioutdoor.com/chaqueta-mujer-brisk-shaggy-pro-jacket-beige-lippi-m22.html,mujer,2022-07-27
Chaqueta Mujer Brisk Shaggy-Pro Jacket Burdeo Lippi,CLP 43.990,https://www.lippioutdoor.com/chaqueta-mujer-brisk-shaggy-pro-jacket-burdeo-lippi-m22.html,mujer,2022-07-27
Chaqueta Mujer Brisk Shaggy-Pro Jacket Laurel Lippi,CLP 43.990,https://www.lippioutdoor.com/chaqueta-mujer-brisk-shaggy-pro-jacket-laurel-lippi-m22.html,mujer,2022-07-27
Poleron Mujer Peliculyon Beige Haka Honu,CLP 29.990,https://www.lippioutdoor.com/poleron-mujer-peliculyon-beige-haka-honu-m22.html,mujer,2022-07-27
Poleron Mujer Peliculyon Negro Haka Honu,CLP 29.990,https://www.lippioutdoor.com/poleron-mujer-peliculyon-negro-haka-honu-m22.html,mujer,2022-07-27
Poleron Mujer Peliculyon Palo Rosa Haka Honu,CLP 29.990,https://www.lippioutdoor.com/poleron-mujer-peliculyon-palo-rosa-haka-honu-m22.html,mujer,2022-07-27
Poleron Mujer Taina Nui Print Rosado Haka Honu,CLP 29.990,https://www.lippioutdoor.com/poleron-mujer-taina-nui-print-azul-haka-honu-m22.html,mujer,2022-07-27
Poleron Mujer Stripes Nano-F Full Zip Frambuesa Lippi,CLP 36.990,https://www.lippioutdoor.com/poleron-mujer-stripes-nano-f-full-zip-frambuesa-lippi-m22.html,mujer,2022-07-27
Poleron Mujer Stripes Nano-F Full Zip Negro Lippi,CLP 36.990,https://www.lippioutdoor.com/poleron-mujer-stripes-nano-f-full-zip-negro-lippi-m22.html,mujer,2022-07-27
Pantalon Mujer Montatelo Negro Haka Honu,CLP 29.990,https://www.lippioutdoor.com/pantalon-mujer-montatelo-negro-haka-honu-m22.html,mujer,2022-07-27
Pantalon Mujer Montatelo Verde Militar Haka Honu,CLP 29.990,https://www.lippioutdoor.com/pantalon-mujer-montatelo-verde-militar-haka-honu-m22.html,mujer,2022-07-27
Poleron Mujer Haka Honu Polaroid Beige,CLP 34.990,https://www.lippioutdoor.com/poleron-mujer-polaroid-beige-v22.html,mujer,2022-07-27
Poleron Mujer Haka Honu Polaroid Negro,CLP 34.990,https://www.lippioutdoor.com/poleron-mujer-polaroid-negro-v22.html,mujer,2022-07-27
Poleron Mujer Haka Honu Polaroid Palo Rosa,CLP 34.990,https://www.lippioutdoor.com/poleron-mujer-polaroid-palo-rosa-v22.html,mujer,2022-07-27
Chaqueta Mujer Altamar Amarillo Haka Honu,CLP 89.990,https://www.lippioutdoor.com/chaqueta-mujer-altamar-amarillo-haka-honu-m22.html,mujer,2022-07-27
Chaqueta Mujer Altamar Coral Haka Honu,CLP 89.990,https://www.lippioutdoor.com/chaqueta-mujer-altamar-coral-haka-honu-m22.html,mujer,2022-07-27
Chaqueta Mujer Kilperry Palo Rosa Haka Honu,CLP 159.990,https://www.lippioutdoor.com/chaqueta-mujer-kilperry-palo-rosa-haka-honu-m22.html,mujer,2022-07-27
Chaqueta Mujer Kilperry Verde Haka Honu,CLP 159.990,https://www.lippioutdoor.com/chaqueta-mujer-kilperry-verde-haka-honu-m22.html,mujer,2022-07-27
Poleron Mujer Canguro Negro Haka Honu,CLP 34.990,https://www.lippioutdoor.com/poleron-mujer-canguro-negro-haka-honu-m22.html,mujer,2022-07-27
Poleron Mujer Canguro Verde Haka Honu,CLP 34.990,https://www.lippioutdoor.com/poleron-mujer-canguro-verde-haka-honu-m22.html,mujer,2022-07-27
Poleron Mujer Canguro Damasco Haka Honu,CLP 34.990,https://www.lippioutdoor.com/poleron-mujer-canguro-damasco-haka-honu-m22.html,mujer,2022-07-27
Guantes B-Connect Therm-Pro Glove Mujer Burdeo Lippi,CLP 15.990,https://www.lippioutdoor.com/guantes-b-connect-therm-pro-glove-mujer-burdeo-lippi-m22.html,mujer,2022-07-27
Gorros Fly Line Blend-Pro Beanie Mujer Vino Lippi,CLP 13.990,https://www.lippioutdoor.com/gorros-fly-line-blend-pro-beanie-mujer-vino-lippi-m22.html,mujer,2022-07-27
Gorros Fly Line Blend-Pro Beanie Mujer Jade Lippi,CLP 13.990,https://www.lippioutdoor.com/gorros-fly-line-blend-pro-beanie-mujer-jade-lippi-m22.html,mujer,2022-07-27
Gorros Fly Line Blend-Pro Beanie Mujer Caqui Lippi,CLP 13.990,https://www.lippioutdoor.com/gorros-fly-line-blend-pro-beanie-mujer-caqui-lippi-m22.html,mujer,2022-07-27
Gorros Fly Line Pom Blend-Pro Beanie Mujer Azul Grisaceo Lippi,CLP 13.990,https://www.lippioutdoor.com/gorros-fly-line-pom-blend-pro-beanie-mujer-azul-grisaceo-lippi-m22.html,mujer,2022-07-27
Gorros Fly Line Pom Blend-Pro Beanie Mujer Café Lippi,CLP 13.990,https://www.lippioutdoor.com/gorros-fly-line-pom-blend-pro-beanie-mujer-cafe-lippi-m22.html,mujer,2022-07-27
Gorros Fly Line Pom Blend-Pro Beanie Mujer Fucsia Lippi,CLP 13.990,https://www.lippioutdoor.com/gorros-fly-line-pom-blend-pro-beanie-mujer-fucsia-lippi-m22.html,mujer,2022-07-27
