nombre producto,precio,link,categoria,fecha
Primera Capa Mujer Skintec 2000 Seamless Top Negro Lippi,CLP 29.990,https://www.lippioutdoor.com/primera-capa-mujer-skintec-2000-seamless-top-negro-i21.html,mujer,2022-07-27
Chaqueta Mujer Blizzard B-Dry Hoody Jacket Verde Mate Lippi,CLP 89.990,https://www.lippioutdoor.com/chaqueta-mujer-blizzard-b-dry-hoody-jacket-verde-mate-i21.html,mujer,2022-07-27
Zapatilla Mujer Vulcano Iron Stone Triple Black Lippi,CLP 54.990,https://www.lippioutdoor.com/zapatilla-mujer-vulcano-iron-stone-triple-black-i21.html,mujer,2022-07-27
Poleron Mujer Warmy Sweatshirt Burdeo Lippi,CLP 29.990,https://www.lippioutdoor.com/poleron-mujer-warmy-sweatshirt-burdeo-lippi.html,mujer,2022-07-27
Polera Deportiva Mujer Core Melange Gris Claro Lippi,CLP 9.990,https://www.lippioutdoor.com/polera-deportiva-mujer-core-melange-gris-claro-gris-v21.html,mujer,2022-07-27
Peto Mujer In-Motion Crossback Bra Melange Lila,CLP 24.990,https://www.lippioutdoor.com/peto-mujer-in-motion-crossback-bra-melange-lila-v22.html,mujer,2022-07-27
Chaqueta Mujer Alpine B-Dry Hoody Jacket Laurel Lippi,CLP 89.990,https://www.lippioutdoor.com/chaqueta-mujer-alpine-b-dry-hoody-jacket-laurel-lippi-m22.html,mujer,2022-07-27
Chaqueta Mujer Velvet Blend-Pro Jacket Melange Verde Lippi,CLP 24.990,https://www.lippioutdoor.com/chaqueta-mujer-velvet-blend-pro-jacket-melange-verde-i21.html,mujer,2022-07-27
Poleron Mujer Stripes Nano-F Full Zip Hoody Mostaza Lippi,CLP 42.990,https://www.lippioutdoor.com/poleron-mujer-stripes-nano-f-full-zip-hoody-mostaza-v22.html,mujer,2022-07-27
Chaqueta Mujer Coronado Therm-Pro Jacket Melange Grafito Lippi,CLP 55.990,https://www.lippioutdoor.com/chaqueta-mujer-coronado-therm-pro-jacket-melange-grafito-lippi-m22.html,mujer,2022-07-27
Chaqueta Mujer Spry Steam-Pro Hoody Jacket Frambuesa,CLP 109.990,https://www.lippioutdoor.com/chaqueta-mujer-spry-steam-pro-hoody-jacket-frambuesa-v22.html,mujer,2022-07-27
Chaqueta Mujer Spry Steam-Pro Hoody Jacket Azul Marino Lippi,CLP 79.990,https://www.lippioutdoor.com/chaqueta-mujer-spry-steam-pro-hoody-jacket-azul-marino-i21.html,mujer,2022-07-27
Zapatilla Mujer Panal Flowshell Gris Lippi,CLP 29.990,https://www.lippioutdoor.com/zapatilla-mujer-panal-flowshell-gris-v20.html,mujer,2022-07-27
Zapatilla Mujer 4River Gris Lippi,CLP 19.990,https://www.lippioutdoor.com/7552-zapatilla-mujer-4river-gris-v20.html,mujer,2022-07-27
Chaqueta Mujer Paicavi Therm-Pro Jacket Gris Claro Lippi,CLP 43.990,https://www.lippioutdoor.com/chaqueta-mujer-paicavi-therm-pro-jacket-gris-claro-v22.html,mujer,2022-07-27
Chaqueta Mujer Nightfall WindBreaker Hoody Jacket Rosa Oscuro Lippi,CLP 54.990,https://www.lippioutdoor.com/chaqueta-mujer-nightfall-windbreaker-hoody-jacket-rosa-oscuro-v22.html,mujer,2022-07-27
Zapatilla Mujer Slate B-Dry Morado,CLP 64.990,https://www.lippioutdoor.com/zapatilla-mujer-slate-b-dry-morado-i18.html,mujer,2022-07-27
Zapatilla Mujer 4River Frambuesa,CLP 19.990,https://www.lippioutdoor.com/zapatilla-mujer-4river-frambuesa-v20.html,mujer,2022-07-27
Chaqueta Mujer Sense Blend-Pro Jacket Melange Red Lippi,CLP 47.990,https://www.lippioutdoor.com/chaqueta-mujer-sense-blend-pro-jacket-melange-red-lippi-m22.html,mujer,2022-07-27
Chaqueta Mujer Spry WindBreaker Nano-F Hoody Jacket Negro Lippi,CLP 69.990,https://www.lippioutdoor.com/chaqueta-mujer-spry-windbreaker-nano-f-hoody-jacket-negro-lippi-v22.html,mujer,2022-07-27
Chaqueta Mujer Tres Cruces Fusion-3 Hoody Jacket Negro/ Negro,CLP 169.990,https://www.lippioutdoor.com/chaqueta-mujer-tres-cruces-fusion-3-hoody-jacket-negro-negro-v22.html,mujer,2022-07-27
Short Mujer Lino Azul V20,CLP 9.990,https://www.lippioutdoor.com/7307-short-mujer-lino-azul-v20.html,mujer,2022-07-27
Sandalia Mujer Go Out Uva Lippi,CLP 12.990,https://www.lippioutdoor.com/sandalia-mujer-go-out-uva-v20.html,mujer,2022-07-27
Zapatilla Mujer Vulcano Iron Stone Bdry Uva Lippi,CLP 74.990,https://www.lippioutdoor.com/zapatilla-mujer-vulcano-iron-stone-bdry-dark-rose-i21.html,mujer,2022-07-27
Primera Capa Mujer Skintec 1000 Seamless Top Short Sleeve Blanco,CLP 22.990,https://www.lippioutdoor.com/primera-capa-mujer-skintec-1000-seamless-top-short-sleeve-blanco-v22.html,mujer,2022-07-27
Short Mujer Challenge Shorts Grafito Lippi,CLP 19.990,https://www.lippioutdoor.com/short-mujer-challenge-shorts-grafito-v22.html,mujer,2022-07-27
Poleron Mujer Stripes Nano-F Full Zip Hoody Frambuesa Lippi,CLP 42.990,https://www.lippioutdoor.com/poleron-mujer-stripes-nano-f-full-zip-hoody-frambuesa-v22.html,mujer,2022-07-27
Chaqueta Mujer Coronado Therm-Pro Jacket Melange Gris Medio Lippi,CLP 55.990,https://www.lippioutdoor.com/chaqueta-mujer-coronado-therm-pro-jacket-melange-gris-medio-lippi-m22.html,mujer,2022-07-27
Primera Capa Mujer Skintec 1000 Seamless Top Short Sleeve Negro,CLP 22.990,https://www.lippioutdoor.com/primera-capa-mujer-skintec-1000-seamless-top-short-sleeve-negro-v22.html,mujer,2022-07-27
Chaqueta Mujer Paicavi Therm-Pro Jacket Blanco Lippi,CLP 43.990,https://www.lippioutdoor.com/chaqueta-mujer-paicavi-therm-pro-jacket-blanco-lippi-m22.html,mujer,2022-07-27
Chaqueta Mujer Ferret Shaggy-Pro Vino I20 Lippi,CLP 44.990,https://www.lippioutdoor.com/7803-chaqueta-mujer-ferret-shaggy-pro-vino-i20.html,mujer,2022-07-27
Calza Mujer In-Action Trekking Leggings Oliva Oscuro Lippi,CLP 32.990,https://www.lippioutdoor.com/calza-mujer-in-action-trekking-leggings-oliva-oscuro-lippi-m22.html,mujer,2022-07-27
Chaqueta Mujer Snowmass Steam-Pro Jacket Gris Medio Lippi,CLP 59.990,https://www.lippioutdoor.com/chaqueta-mujer-snowmass-steam-pro-jacket-gris-medio-v22.html,mujer,2022-07-27
Polera Mujer Summer UV-Stop Tank Celeste,CLP 11.490,https://www.lippioutdoor.com/polera-mujer-summer-uv-stop-tank-celeste-v22.html,mujer,2022-07-27
Poleron Mujer Warmy Sweatshirt Rosa Oscuro Lippi,CLP 24.990,https://www.lippioutdoor.com/poleron-mujer-warmy-sweatshirt-rosa-oscuro-v22.html,mujer,2022-07-27
Poleron Mujer Jacaranda Nano-F 14 Zip Celeste Lippi,CLP 39.990,https://www.lippioutdoor.com/poleron-mujer-jacaranda-nano-f-14-zip-celeste-v22.html,mujer,2022-07-27
Chaqueta Mujer Andes B-Dry Hoody Negro I20 Lippi,CLP 143.990,https://www.lippioutdoor.com/7785-chaqueta-mujer-andes-b-dry-hoody-negro-i20.html,mujer,2022-07-27
Polera Mujer Crossback Organic T-Shirt Laurel,CLP 11.490,https://www.lippioutdoor.com/polera-mujer-crossback-organic-t-shirt-laurel-v22.html,mujer,2022-07-27
Chaqueta Mujer Aspen Down Jacket Azul V19 Lippi,CLP 39.990,https://www.lippioutdoor.com/chaqueta-mujer-aspen-down-hoody-jacket-azul-v19-v18.html,mujer,2022-07-27
Chaqueta Mujer Spry WindBreaker Hoody Jacket Negro Lippi,CLP 38.990,https://www.lippioutdoor.com/chaqueta-mujer-spry-windbreaker-hoody-jacket-negro-v22.html,mujer,2022-07-27
Bota Mujer Polar Light Gris I20 Lippi,CLP 62.990,https://www.lippioutdoor.com/8320-bota-mujer-polar-light-gris-i20.html,mujer,2022-07-27
Peto Mujer In-Motion Stripes Bra Vino Lippi,CLP 8.990,https://www.lippioutdoor.com/peto-mujer-in-motion-stripes-bra-vino-v22.html,mujer,2022-07-27
Chaqueta Mujer Spry WindBreaker Hoody Jacket Frambuesa Lippi,CLP 38.990,https://www.lippioutdoor.com/chaqueta-mujer-spry-windbreaker-hoody-jacket-frambuesa-v22.html,mujer,2022-07-27
Polera Deportiva Tank Mujer Trained Q-Dry Melange Uva Lippi,CLP 11.490,https://www.lippioutdoor.com/polera-deportiva-tank-mujer-trained-q-dry-melange-uva-uva-v21.html,mujer,2022-07-27
Poleron Mujer Just Move Nano-F 14 Zip Grafito,CLP 25.990,https://www.lippioutdoor.com/poleron-mujer-just-move-nano-f-14-zip-grafito-v22.html,mujer,2022-07-27
Sandalia Mujer Take & Go Turquesa Lippi,CLP 9.990,https://www.lippioutdoor.com/sandalia-mujer-take-go-turquesa-v21.html,mujer,2022-07-27
Short Mujer Lino Verde V20,CLP 9.990,https://www.lippioutdoor.com/7308-short-mujer-lino-verde-v20.html,mujer,2022-07-27
Primera Capa Mujer Skintec 1000 Seamless Top Blanco Lippi,CLP 22.990,https://www.lippioutdoor.com/primera-capa-mujer-skintec-1000-seamless-top-blanco-lippi-v22.html,mujer,2022-07-27
Zapatilla Mujer Vulcano Iron Stone Celestial Black Lippi,CLP 54.990,https://www.lippioutdoor.com/zapatilla-mujer-vulcano-iron-stone-celestial-black-i21.html,mujer,2022-07-27
Primera Capa Mujer Skintec 1000 Seamless Top Short Sleeve Coral,CLP 22.990,https://www.lippioutdoor.com/primera-capa-mujer-skintec-1000-seamless-top-short-sleeve-coral-v22.html,mujer,2022-07-27
Botín Mujer Slate B-Dry Turquesa,CLP 64.990,https://www.lippioutdoor.com/botin-mujer-slate-b-dry-turquesa-v22.html,mujer,2022-07-27
Poleron Mujer Warmy Sweatshirt Grafito Lippi,CLP 24.990,https://www.lippioutdoor.com/poleron-mujer-warmy-sweatshirt-grafito-v22.html,mujer,2022-07-27
Pantalon Mujer Infinity Q-Dry Pants Laurel Lippi,CLP 29.990,https://www.lippioutdoor.com/pantalon-mujer-infinity-q-dry-pants-laurel-v22.html,mujer,2022-07-27
Primera Capa Mujer Skintec 1000 Seamless Top Short Sleeve Jade,CLP 22.990,https://www.lippioutdoor.com/primera-capa-mujer-skintec-1000-seamless-top-short-sleeve-jade-v22.html,mujer,2022-07-27
Polera Mujer Breeze Seamless T-Shirt Grafito,CLP 11.490,https://www.lippioutdoor.com/polera-mujer-breeze-seamless-t-shirt-grafito-v22.html,mujer,2022-07-27
Zapato Mujer EcoWoods Gris Oscuro Lippi,CLP 54.990,https://www.lippioutdoor.com/8255-zapato-mujer-ecowoods-gris-oscuro.html,mujer,2022-07-27
Chaqueta Mujer Blizzard B-Dry Hoody Jacket Mostaza Lippi,CLP 89.990,https://www.lippioutdoor.com/chaqueta-mujer-blizzard-b-dry-hoody-jacket-mostaza-i21.html,mujer,2022-07-27
Zapatilla Mujer Vulcano Iron Stone Bdry Grey Green Lippi,CLP 74.990,https://www.lippioutdoor.com/zapatilla-mujer-vulcano-iron-stone-bdry-grey-green-i21.html,mujer,2022-07-27
Polera Mujer Crossback Organic T-Shirt Negro,CLP 11.490,https://www.lippioutdoor.com/polera-mujer-crossback-organic-t-shirt-negro-v22.html,mujer,2022-07-27
Polera Deportiva Mujer B-Ready Seamless Frambuesa Lippi,CLP 6.990,https://www.lippioutdoor.com/polera-deportiva-mujer-b-ready-seamless-frambuesa-frambuesa-v21.html,mujer,2022-07-27
Polera Mujer Crossback Organic T-Shirt Vino,CLP 11.490,https://www.lippioutdoor.com/polera-mujer-crossback-organic-t-shirt-vino-v22.html,mujer,2022-07-27
Poleron Mujer Warmy Sweatshirt Vino Lippi,CLP 24.990,https://www.lippioutdoor.com/poleron-mujer-warmy-sweatshirt-vino-v22.html,mujer,2022-07-27
Chaqueta Mujer Furry Shaggy-Pro Jacket Crudo Lippi,CLP 44.990,https://www.lippioutdoor.com/chaqueta-mujer-furry-shaggy-pro-jacket-crudo-i21.html,mujer,2022-07-27
Chaqueta Mujer Snowmass Steam-Pro Jacket Burdeo Lippi,CLP 59.990,https://www.lippioutdoor.com/chaqueta-mujer-snowmass-steam-pro-jacket-burdeo-v22.html,mujer,2022-07-27
Calza Mujer In-Action Trekking Leggings Negro Lippi,CLP 32.990,https://www.lippioutdoor.com/calza-mujer-in-action-trekking-leggings-negro-v22.html,mujer,2022-07-27
Camisa Mujer Rosselot Long Sleeve Q-Dry Shirt Azul Grisaceo Lippi,CLP 42.990,https://www.lippioutdoor.com/camisa-mujer-rosselot-long-sleeve-q-dry-shirt-azul-grisaceo-v22.html,mujer,2022-07-27
Poleron Mujer Just Move Nano-F 14 Zip Vino,CLP 25.990,https://www.lippioutdoor.com/poleron-mujer-just-move-nano-f-14-zip-vino-v22.html,mujer,2022-07-27
Camisa Mujer Rosselot Long Sleeve Q-Dry Shirt Beige Lippi,CLP 42.990,https://www.lippioutdoor.com/camisa-mujer-rosselot-long-sleeve-q-dry-shirt-beige-v22.html,mujer,2022-07-27
Chaqueta Mujer Brisk Shaggy-Pro Jacket Negro Lippi,CLP 27.990,https://www.lippioutdoor.com/chaqueta-mujer-brisk-shaggy-pro-jacket-negro-lippi-m22.html,mujer,2022-07-27
Chaqueta Mujer Spry Steam-Pro Hoody Jacket Vino,CLP 109.990,https://www.lippioutdoor.com/chaqueta-mujer-spry-steam-pro-hoody-jacket-vino-v22.html,mujer,2022-07-27
Calzas Deportivas Seamless Mujer In-Motion Negro Lippi,CLP 14.990,https://www.lippioutdoor.com/calzas-deportivas-seamless-mujer-in-motion-negro-negro-v21.html,mujer,2022-07-27
Chaqueta Mujer Spry WindBreaker 14 Zip Hoody Jacket Vino Lippi,CLP 41.990,https://www.lippioutdoor.com/chaqueta-mujer-spry-windbreaker-14-zip-hoody-jacket-vino-v22.html,mujer,2022-07-27
Short Mujer Go For It Shorts Azul Grisaceo,CLP 12.990,https://www.lippioutdoor.com/short-mujer-go-for-it-shorts-azul-grisaceo-v22.html,mujer,2022-07-27
Chaqueta Cortaviento Mujer Nightfall Hoody Print Malva Lippi,CLP 24.990,https://www.lippioutdoor.com/chaqueta-cortaviento-mujer-nightfall-hoody-print-malva-malva-v21.html,mujer,2022-07-27
Poleron Mujer Just Move Nano-F 14 Zip Lila,CLP 25.990,https://www.lippioutdoor.com/poleron-mujer-just-move-nano-f-14-zip-lila-v22.html,mujer,2022-07-27
Zapatilla Mujer Vulcano Moon Stone Black Sky Lippi,CLP 54.990,https://www.lippioutdoor.com/zapatilla-mujer-vulcano-moon-stone-black-sky-i21.html,mujer,2022-07-27
Zapato Mujer Puelo CS Low Gris Lippi,CLP 69.990,https://www.lippioutdoor.com/zapato-mujer-puelo-cs-low-gris-i15.html,mujer,2022-07-27
Vestido Mujer Sheer Dress Print Laurel,CLP 9.990,https://www.lippioutdoor.com/vestido-mujer-sheer-dress-print-laurel-v22.html,mujer,2022-07-27
Chaqueta Mujer Nightfall WindBreaker Hoody Jacket Azul Piedra Lippi,CLP 54.990,https://www.lippioutdoor.com/chaqueta-mujer-nightfall-windbreaker-hoody-jacket-azul-piedra-v22.html,mujer,2022-07-27
Chaqueta Mujer Spry WindBreaker 14 Zip Hoody Jacket Oliva Lippi,CLP 41.990,https://www.lippioutdoor.com/chaqueta-mujer-spry-windbreaker-14-zip-hoody-jacket-oliva-v22.html,mujer,2022-07-27
Zapatilla Mujer Wool Step City Cream Lippi,CLP 34.990,https://www.lippioutdoor.com/zapatilla-mujer-wool-step-city-cream-lippi-v22.html,mujer,2022-07-27
Peto Mujer In-Motion Crossback Bra Negro,CLP 24.990,https://www.lippioutdoor.com/peto-mujer-in-motion-crossback-bra-negro-v22.html,mujer,2022-07-27
Zapatilla Mujer Wool Step Slip On Light Grey Lippi,CLP 29.990,https://www.lippioutdoor.com/zapatilla-mujer-wool-step-slip-on-light-grey-lippi-v22.html,mujer,2022-07-27
Poleron Mujer Numan Nano-F Jacket Negro,CLP 42.990,https://www.lippioutdoor.com/poleron-mujer-numan-nano-f-jacket-negro-v22.html,mujer,2022-07-27
Botin Mujer All Terra Mid Acero Lippi,CLP 84.990,https://www.lippioutdoor.com/botin-mujer-all-terra-mid-verde-i21.html,mujer,2022-07-27
Chaqueta Mujer Ultimate Stretch Down Jacket Laurel Lippi,CLP 99.990,https://www.lippioutdoor.com/chaqueta-mujer-ultimate-stretch-down-jacket-laurel-lippi-m22.html,mujer,2022-07-27
Polera Mujer Core Q-Dry Breathing T-Shirt Oliva Oscuro Lippi,CLP 9.990,https://www.lippioutdoor.com/polera-mujer-core-q-dry-breathing-t-shirt-oliva-oscuro-v22.html,mujer,2022-07-27
Chaqueta Mujer Paicavi Therm-Pro Jacket Negro Lippi,CLP 43.990,https://www.lippioutdoor.com/chaqueta-mujer-paicavi-therm-pro-jacket-negro-i21.html,mujer,2022-07-27
Sandalia Mujer Take & Go Lima Lippi,CLP 9.990,https://www.lippioutdoor.com/sandalia-mujer-take-go-lima-v21.html,mujer,2022-07-27
Chaqueta Mujer Furry Shaggy-Pro Jacket Grafito Lippi,CLP 44.990,https://www.lippioutdoor.com/chaqueta-mujer-furry-shaggy-pro-jacket-grafito-i21.html,mujer,2022-07-27
Poleron Mujer Lighter Nano-F 1/4 Zip Frambuesa Lippi,CLP 44.990,https://www.lippioutdoor.com/poleron-mujer-lighter-nano-f-1-4-zip-frambuesa-lippi-m22.html,mujer,2022-07-27
Polera Mujer Summer UV-Stop Tank Vino,CLP 11.490,https://www.lippioutdoor.com/polera-mujer-summer-uv-stop-tank-vino-v22.html,mujer,2022-07-27
Primera Capa Mujer Skintec 3000 1/4 Zip Vino Lippi,CLP 69.990,https://www.lippioutdoor.com/primera-capa-mujer-skintec-3000-1-4-zip-vino-lippi-m22.html,mujer,2022-07-27
Polera Mujer Summer UV-Stop Tank Grafito,CLP 11.490,https://www.lippioutdoor.com/polera-mujer-summer-uv-stop-tank-grafito-v22.html,mujer,2022-07-27
Short Mujer Fury Shorts Verde Grisaceo,CLP 24.990,https://www.lippioutdoor.com/short-mujer-fury-shorts-verde-grisaceo-v22.html,mujer,2022-07-27
Poleron Mujer Numan Nano-F Jacket Taupe,CLP 42.990,https://www.lippioutdoor.com/poleron-mujer-numan-nano-f-jacket-taupe-v22.html,mujer,2022-07-27
Chaqueta Mujer Spry WindBreaker Hoody Jacket Oliva Lippi,CLP 38.990,https://www.lippioutdoor.com/chaqueta-mujer-spry-windbreaker-hoody-jacket-oliva-v22.html,mujer,2022-07-27
Calza Mujer In-Motion Seamless Leggings Low Waist Negro Lippi,CLP 10.990,https://www.lippioutdoor.com/calza-mujer-in-motion-seamless-leggings-low-waist-negro-v22.html,mujer,2022-07-27
Peto Seamless Mujer In-Action Grafito Lippi,CLP 9.990,https://www.lippioutdoor.com/peto-seamless-mujer-in-action-grafito-grafito-v21.html,mujer,2022-07-27
Short Mujer Challenge Shorts Gris Lippi,CLP 19.990,https://www.lippioutdoor.com/short-mujer-challenge-shorts-gris-v22.html,mujer,2022-07-27
Polera Tank Mujer Summit UV-Stop Melange Malva Lippi,CLP 8.990,https://www.lippioutdoor.com/polera-tank-mujer-summit-uv-stop-melange-malva-malva-v21.html,mujer,2022-07-27
Chaqueta Mujer Macaya Softshell Hoody Jacket Melange Burdeo Lippi,CLP 49.990,https://www.lippioutdoor.com/chaqueta-mujer-macaya-softshell-hoody-jacket-melange-burdeo-i21.html,mujer,2022-07-27
Polera Mujer Breeze Seamless T-Shirt Blanco,CLP 11.490,https://www.lippioutdoor.com/polera-mujer-breeze-seamless-t-shirt-blanco-v22.html,mujer,2022-07-27
Calza Mujer In-Action Seamless Leggings Vino Lippi,CLP 14.990,https://www.lippioutdoor.com/calza-mujer-in-action-seamless-leggings-vino-v22.html,mujer,2022-07-27
Sandalia Mujer Take & Go Indigo Lippi,CLP 9.990,https://www.lippioutdoor.com/sandalia-mujer-take-go-indigo-v21.html,mujer,2022-07-27
Calza Mujer In-Motion Seamless Leggings High Waist Negro Lippi,CLP 10.990,https://www.lippioutdoor.com/calza-mujer-in-motion-seamless-leggings-high-waist-negro-v22.html,mujer,2022-07-27
Chaqueta Mujer Venture Steam-Pro Hoody Púrpura I20 Lippi,CLP 87.990,https://www.lippioutdoor.com/8231-chaqueta-mujer-venture-steam-pro-hoody-p-rpura-i20.html,mujer,2022-07-27
Poleron Mujer Insigne Hoody Sweatshirt Melange Gris,CLP 39.990,https://www.lippioutdoor.com/poleron-mujer-insigne-hoody-sweatshirt-melange-gris-v22.html,mujer,2022-07-27
Primera Capa Mujer Skintec 1000 Seamless Top Short Sleeve Sangria,CLP 22.990,https://www.lippioutdoor.com/primera-capa-mujer-skintec-1000-seamless-top-short-sleeve-sangria-v22.html,mujer,2022-07-27
Chaqueta Mujer Spry WindBreaker Hoody Jacket Vino Lippi,CLP 38.990,https://www.lippioutdoor.com/chaqueta-mujer-spry-windbreaker-hoody-jacket-vino-v22.html,mujer,2022-07-27
Polera Mujer Essential UV-Stop T-Shirt Crudo Full Print Lippi,CLP 9.990,https://www.lippioutdoor.com/polera-mujer-essential-uv-stop-t-shirt-crudo-full-print-v22.html,mujer,2022-07-27
Sandalia Mujer Go Out Gris V20,CLP 12.990,https://www.lippioutdoor.com/7513-sandalia-mujer-go-out-gris-v20.html,mujer,2022-07-27
Polera Mujer Summit UV-Stop Tank Gris Medio Lippi,CLP 8.990,https://www.lippioutdoor.com/polera-mujer-summit-uv-stop-tank-gris-medio-lippi-v22.html,mujer,2022-07-27
Poleron Mujer Baggy Sweatshirt Laurel Lippi,CLP 34.990,https://www.lippioutdoor.com/poleron-mujer-baggy-sweatshirt-laurel-i21.html,mujer,2022-07-27
Polera Mujer Breeze Seamless T-Shirt Arena,CLP 11.490,https://www.lippioutdoor.com/polera-mujer-breeze-seamless-t-shirt-arena-v22.html,mujer,2022-07-27
Botín Mujer Terray Mid Turquesa Lippi,CLP 99.990,https://www.lippioutdoor.com/botin-mujer-terray-mid-turquesa-v19.html,mujer,2022-07-27
Chaqueta Mujer Ferret Shaggy-Pro Jacket Negro Lippi,CLP 47.990,https://www.lippioutdoor.com/chaqueta-mujer-ferret-shaggy-pro-jacket-negro-v22.html,mujer,2022-07-27
Primera Capa Mujer Skintec 2000 warm Bottom Negro Lippi,CLP 29.990,https://www.lippioutdoor.com/primera-capa-mujer-skintec-2000-warm-bottom-negro-i020.html,mujer,2022-07-27
Vestido Mujer Sheer Dress Print Negro,CLP 9.990,https://www.lippioutdoor.com/vestido-mujer-sheer-dress-print-negro-v22.html,mujer,2022-07-27
Poleron Mujer Insigne Hoody Sweatshirt Azul Piedra,CLP 39.990,https://www.lippioutdoor.com/poleron-mujer-insigne-hoody-sweatshirt-azul-piedra-v22.html,mujer,2022-07-27
Polera Tank Mujer Summit UV-Stop Melange Palo Rosa Lippi,CLP 8.990,https://www.lippioutdoor.com/polera-tank-mujer-summit-uv-stop-melange-palo-rosa-rosa-v21.html,mujer,2022-07-27
Chaqueta Mujer Furry Shaggy-Pro Jacket Burdeo Lippi,CLP 44.990,https://www.lippioutdoor.com/chaqueta-mujer-furry-shaggy-pro-jacket-burdeo-i21.html,mujer,2022-07-27
Poleron Mujer Insigne Full Zip Hoody Sweatshirt Melange Azul Marino,CLP 42.990,https://www.lippioutdoor.com/poleron-mujer-insigne-full-zip-hoody-sweatshirt-melange-azul-marino-v22.html,mujer,2022-07-27
Chaqueta Mujer Spry WindBreaker 14 Zip Hoody Jacket Negro Lippi,CLP 41.990,https://www.lippioutdoor.com/chaqueta-mujer-spry-windbreaker-14-zip-hoody-jacket-negro-v22.html,mujer,2022-07-27
Chaqueta Mujer Sense Blend-Pro Hoody Jacket Melange Red,CLP 38.990,https://www.lippioutdoor.com/chaqueta-mujer-sense-blend-pro-hoody-jacket-melange-red-v22.html,mujer,2022-07-27
Poleron Mujer Baggy Sweatshirt Malva Lippi,CLP 34.990,https://www.lippioutdoor.com/poleron-mujer-baggy-sweatshirt-malva-i21.html,mujer,2022-07-27
Calza Mujer In-Action Trekking Leggings Vino Lippi,CLP 34.990,https://www.lippioutdoor.com/calza-mujer-in-action-trekking-leggings-vino-lippi-m22.html,mujer,2022-07-27
Chaqueta Mujer Macaya Softshell Hoody Jacket Melange Gris Lippi,CLP 49.990,https://www.lippioutdoor.com/chaqueta-mujer-macaya-softshell-hoody-jacket-melange-gris-i21.html,mujer,2022-07-27
Poleron Mujer Jacaranda Nano-F 1/4 Zip Negro Lippi,CLP 39.990,https://www.lippioutdoor.com/poleron-mujer-jacaranda-nano-f-1-4-zip-negro-i21.html,mujer,2022-07-27
Chaqueta Mujer Macaya Softshell Hoody Jacket Negro Lippi,CLP 49.990,https://www.lippioutdoor.com/chaqueta-mujer-macaya-softshell-hoody-jacket-negro-i21.html,mujer,2022-07-27
Poleron Mujer Jacaranda Mountain Nano-F 14 Zip Hoody Verde Grisaceo Lippi,CLP 44.990,https://www.lippioutdoor.com/poleron-mujer-jacaranda-mountain-nano-f-14-zip-hoody-verde-grisaceo-lippi-v22.html,mujer,2022-07-27
Pantalon Mujer Enduring Mix-2 Q-Dry Pants Gris Oscuro,CLP 59.990,https://www.lippioutdoor.com/pantalon-mujer-enduring-mix-2-q-dry-pants-gris-oscuro-v22.html,mujer,2022-07-27
Chaqueta Mujer Bazpur Down Hoody Verde I19 Lippi,CLP 119.990,https://www.lippioutdoor.com/8221-chaqueta-mujer-bazpur-down-hoody-verde-i19.html,mujer,2022-07-27
Chaqueta Mujer Sense Blend-Pro Hoody Jacket Melange Blue,CLP 38.990,https://www.lippioutdoor.com/chaqueta-mujer-sense-blend-pro-hoody-jacket-melange-blue-v22.html,mujer,2022-07-27
Bota Mujer Polar Light Verde I20 Lippi,CLP 62.990,https://www.lippioutdoor.com/8321-bota-mujer-polar-light-verde-i20.html,mujer,2022-07-27
Primera Capa Mujer Skintec 1000 Seamless Bottom Negro Lippi,CLP 17.990,https://www.lippioutdoor.com/primera-capa-mujer-skintec-1000-seamless-bottom-negro-i21.html,mujer,2022-07-27
Poleron Mujer Insigne Sweatshirt Vino,CLP 34.990,https://www.lippioutdoor.com/poleron-mujer-insigne-sweatshirt-vino-v22.html,mujer,2022-07-27
Chaqueta Mujer Spry WindBreaker Nano-F Hoody Jacket Oliva Lippi,CLP 69.990,https://www.lippioutdoor.com/chaqueta-mujer-spry-windbreaker-nano-f-hoody-jacket-oliva-lippi-v22.html,mujer,2022-07-27
Calzas Deportivas Seamless Mujer In-Motion Negro / Blanco Lippi,CLP 14.990,https://www.lippioutdoor.com/calzas-deportivas-seamless-mujer-in-motion-negro-blanco-negro-blanco-v21.html,mujer,2022-07-27
Peto Mujer In-Motion Stripes Bra Grafito Lippi,CLP 8.990,https://www.lippioutdoor.com/peto-mujer-in-motion-stripes-bra-grafito-v22.html,mujer,2022-07-27
Peto Mujer In-Motion Crossback Bra Melange Celeste,CLP 24.990,https://www.lippioutdoor.com/peto-mujer-in-motion-crossback-bra-melange-celeste-v22.html,mujer,2022-07-27
Polera Mujer Essential UV-Stop T-Shirt Celeste Full Print Lippi,CLP 9.990,https://www.lippioutdoor.com/polera-mujer-essential-uv-stop-t-shirt-celeste-full-print-v22.html,mujer,2022-07-27
Polera Mujer Sunset T-Shirt Gris Claro,CLP 11.490,https://www.lippioutdoor.com/polera-mujer-sunset-t-shirt-gris-claro-v22.html,mujer,2022-07-27
Chaqueta Mujer Sense Blend-Pro Hoody Jacket Melange Grafito Lippi,CLP 38.990,https://www.lippioutdoor.com/chaqueta-mujer-sense-blend-pro-hoody-jacket-melange-grafito-i21.html,mujer,2022-07-27
Polera Mujer Botanical T-Shirt Print Laurel,CLP 11.490,https://www.lippioutdoor.com/polera-mujer-botanical-t-shirt-print-laurel-v22.html,mujer,2022-07-27
Polera Mujer Core Q-Dry Breathing T-Shirt Negro Lippi,CLP 9.990,https://www.lippioutdoor.com/polera-mujer-core-q-dry-breathing-t-shirt-negro-v22.html,mujer,2022-07-27
Botin Mujer Puelo CS Hi Turquesa Lippi,CLP 74.990,https://www.lippioutdoor.com/4622-botin-mujer-puelo-cs-hi-turquesa.html,mujer,2022-07-27
Polera Mujer Core Q-Dry Breathing T-Shirt Vino Lippi,CLP 9.990,https://www.lippioutdoor.com/polera-mujer-core-q-dry-breathing-t-shirt-vino-v22.html,mujer,2022-07-27
Poleron Mujer Baggy Sweatshirt Grafito Lippi,CLP 34.990,https://www.lippioutdoor.com/poleron-mujer-baggy-sweatshirt-grafito-i21.html,mujer,2022-07-27
Polera Mujer Sunset T-Shirt Azul Piedra,CLP 11.490,https://www.lippioutdoor.com/polera-mujer-sunset-t-shirt-azul-piedra-v22.html,mujer,2022-07-27
Peto Mujer In-Motion Stripes Bra Malva Lippi,CLP 8.990,https://www.lippioutdoor.com/peto-mujer-in-motion-stripes-bra-malva-v22.html,mujer,2022-07-27
Poleron Mujer Lighter Nano-F 14 Zip Arena,CLP 44.990,https://www.lippioutdoor.com/poleron-mujer-lighter-nano-f-14-zip-arena-v22.html,mujer,2022-07-27
Poleron Mujer Jacaranda Nano-F 1/4 Zip Hoody Jade Lippi,CLP 42.990,https://www.lippioutdoor.com/poleron-mujer-jacaranda-nano-f-1-4-zip-hoody-jade-i21.html,mujer,2022-07-27
Polera Mujer Essential UV-Stop T-Shirt Vino Full Print Lippi,CLP 9.990,https://www.lippioutdoor.com/polera-mujer-essential-uv-stop-t-shirt-vino-full-print-v22.html,mujer,2022-07-27
Poleron Mujer Jacaranda Nano-F 1/4 Zip Hoody Negro Lippi,CLP 42.990,https://www.lippioutdoor.com/poleron-mujer-jacaranda-nano-f-1-4-zip-hoody-negro-i21.html,mujer,2022-07-27
Poleron Mujer Lighter Nano-F 14 Zip Verde Oscuro,CLP 44.990,https://www.lippioutdoor.com/poleron-mujer-lighter-nano-f-14-zip-verde-oscuro-v22.html,mujer,2022-07-27
Poleron Mujer Jacaranda Nano-F 14 Zip Hoody Lila Lippi,CLP 42.990,https://www.lippioutdoor.com/poleron-mujer-jacaranda-nano-f-14-zip-hoody-lila-v22.html,mujer,2022-07-27
