nombre producto,precio,link,categoria,fecha
Primera Capa Mujer Skintec 2000 Seamless Bottom Negro Lippi,CLP 27.990,https://www.lippioutdoor.com/primera-capa-mujer-skintec-2000-seamless-bottom-negro-i21.html,mujer,2022-07-27
Chaqueta Mujer Seek Softshell Hoody Azul V20,CLP 59.990,https://www.lippioutdoor.com/7093-chaqueta-mujer-seek-softshell-hoody-azul-v20.html,mujer,2022-07-27
Botin Mujer Puelo CS Low Grafito Lippi,CLP 69.990,https://www.lippioutdoor.com/4625-botin-mujer-puelo-cs-low-gr-fito.html,mujer,2022-07-27
Pantalon Mujer Infinity Q-Dry Pants Grafito Lippi,CLP 29.990,https://www.lippioutdoor.com/pantalon-mujer-infinity-q-dry-pants-grafito-v22.html,mujer,2022-07-27
Chaqueta Mujer Spry WindBreaker 14 Zip Hoody Jacket Frambuesa Lippi,CLP 41.990,https://www.lippioutdoor.com/chaqueta-mujer-spry-windbreaker-14-zip-hoody-jacket-frambuesa-v22.html,mujer,2022-07-27
Chaqueta Mujer Spry WindBreaker Nano-F Hoody Jacket Vino Lippi,CLP 69.990,https://www.lippioutdoor.com/chaqueta-mujer-spry-windbreaker-nano-f-hoody-jacket-vino-lippi-v22.html,mujer,2022-07-27
Calzas Deportivas Seamless Mujer In-Action Malva Lippi,CLP 14.990,https://www.lippioutdoor.com/calzas-deportivas-seamless-mujer-in-action-malva-malva-v21.html,mujer,2022-07-27
Poleron Mujer Insigne Hoody Sweatshirt Verde Grisaseo,CLP 39.990,https://www.lippioutdoor.com/poleron-mujer-insigne-hoody-sweatshirt-verde-grisaseo-v22.html,mujer,2022-07-27
Calza Mujer In-Motion Seamless Leggings High Waist Melange Malva Lippi,CLP 10.990,https://www.lippioutdoor.com/calza-mujer-in-motion-seamless-leggings-high-waist-melange-malva-v22.html,mujer,2022-07-27
Chaqueta Mujer Peumo Hoody Vino I20 Lippi,CLP 95.990,https://www.lippioutdoor.com/7817-chaqueta-mujer-peumo-hoody-vino-i20.html,mujer,2022-07-27
Poleron Mujer Lighter Nano-F 1/4 Zip Grafito Lippi,CLP 44.990,https://www.lippioutdoor.com/poleron-mujer-lighter-nano-f-1-4-zip-grafito-grafito-v21.html,mujer,2022-07-27
Primera Capa Mujer Skintec 2000 warm Top Negro Lippi,CLP 29.990,https://www.lippioutdoor.com/primera-capa-mujer-skintec-2000-warm-top-negro-i020.html,mujer,2022-07-27
Poleron Mujer Insigne Sweatshirt Gris,CLP 34.990,https://www.lippioutdoor.com/poleron-mujer-insigne-sweatshirt-gris-v22.html,mujer,2022-07-27
Poleron Mujer Lighter Nano-F 14 Zip Grafito,CLP 44.990,https://www.lippioutdoor.com/poleron-mujer-lighter-nano-f-14-zip-grafito-v22.html,mujer,2022-07-27
Calzas Deportivas Seamless Mujer In-Motion Melange Grafito Lippi,CLP 14.990,https://www.lippioutdoor.com/calzas-deportivas-seamless-mujer-in-motion-melange-grafito-grafito-v21.html,mujer,2022-07-27
Poleron Mujer Insigne Hoody Sweatshirt Rosa Oscuro,CLP 39.990,https://www.lippioutdoor.com/poleron-mujer-insigne-hoody-sweatshirt-rosa-oscuro-v22.html,mujer,2022-07-27
Poleron Mujer Stripes Nano-F Full Zip Hoody Grafito Lippi,CLP 24.990,https://www.lippioutdoor.com/poleron-mujer-stripes-nano-f-full-zip-hoody-grafito-i21.html,mujer,2022-07-27
Polera Mujer Crossback Organic T-Shirt Blanco,CLP 11.490,https://www.lippioutdoor.com/polera-mujer-crossback-organic-t-shirt-blanco-v22.html,mujer,2022-07-27
Polera Mujer Breeze Seamless T-Shirt Lila,CLP 11.490,https://www.lippioutdoor.com/polera-mujer-breeze-seamless-t-shirt-lila-v22.html,mujer,2022-07-27
Chaqueta Mujer Seek Softshell Hoody Vino I20 Lippi,CLP 59.990,https://www.lippioutdoor.com/7822-chaqueta-mujer-seek-softshell-hoody-vino-i20.html,mujer,2022-07-27
Chaqueta Mujer Peumo Hoody Verde Oscuro I20 Lippi,CLP 95.990,https://www.lippioutdoor.com/7816-chaqueta-mujer-peumo-hoody-verde-oscuro-i20.html,mujer,2022-07-27
Chaqueta Mujer Sense Blend-Pro Hoody Jacket Melange Palo Rosa Lippi,CLP 38.990,https://www.lippioutdoor.com/chaqueta-mujer-sense-blend-pro-hoody-jacket-melange-palo-rosa-i21.html,mujer,2022-07-27
Polera Mujer Summit UVStop Tank Gris V19,CLP 8.990,https://www.lippioutdoor.com/5160-polera-mujer-summit-uvstop-tank-gris-v19.html,mujer,2022-07-27
Polera Sin Mangas Mujer Sunset Caqui Lippi,CLP 11.490,https://www.lippioutdoor.com/polera-sin-mangas-mujer-sunset-caqui-caqui-v21.html,mujer,2022-07-27
Poleron Mujer Insigne Hoody Sweatshirt Lila Melange,CLP 39.990,https://www.lippioutdoor.com/poleron-mujer-insigne-hoody-sweatshirt-lila-melange-v22.html,mujer,2022-07-27
Poleron Mujer Insigne Full Zip Hoody Sweatshirt Melange Grafito,CLP 42.990,https://www.lippioutdoor.com/poleron-mujer-insigne-full-zip-hoody-sweatshirt-melange-grafito-v22.html,mujer,2022-07-27
Poleron Mujer Insigne Full Zip Hoody Sweatshirt Laurel,CLP 42.990,https://www.lippioutdoor.com/poleron-mujer-insigne-full-zip-hoody-sweatshirt-laurel-v22.html,mujer,2022-07-27
Calza Mujer In-Motion Seamless Leggings High Waist Melange Grafito Lippi,CLP 10.990,https://www.lippioutdoor.com/calza-mujer-in-motion-seamless-leggings-high-waist-melange-grafito-v22.html,mujer,2022-07-27
Calzas Deportivas Seamless Mujer In-Action Grafito Lippi,CLP 14.990,https://www.lippioutdoor.com/calzas-deportivas-seamless-mujer-in-action-grafito-grafito-v21.html,mujer,2022-07-27
Polera Mujer Sunset T-Shirt Verde Grisaceo,CLP 11.490,https://www.lippioutdoor.com/polera-mujer-sunset-t-shirt-verde-grisaceo-v22.html,mujer,2022-07-27
Chaqueta Mujer Ferret Shaggy-Pro Taupe I20 Lippi,CLP 47.990,https://www.lippioutdoor.com/7802-chaqueta-mujer-ferret-shaggy-pro-taupe-i20.html,mujer,2022-07-27
Poleron Mujer Insigne Sweatshirt Grafito,CLP 34.990,https://www.lippioutdoor.com/poleron-mujer-insigne-sweatshirt-grafito-v22.html,mujer,2022-07-27
Chaqueta Mujer Venture Steam-Pro Hoody Mostaza I20 Lippi,CLP 87.990,https://www.lippioutdoor.com/8230-chaqueta-mujer-venture-steam-pro-hoody-mostaza-i20.html,mujer,2022-07-27
Polera Sin Mangas Mujer Sunset Grafito Lippi,CLP 11.490,https://www.lippioutdoor.com/polera-sin-mangas-mujer-sunset-grafito-grafito-v21.html,mujer,2022-07-27
Calza Mujer In-Motion Seamless Short Leggings Negro Lippi,CLP 9.990,https://www.lippioutdoor.com/calza-mujer-in-motion-seamless-short-leggings-negro-v22.html,mujer,2022-07-27
Polera Mujer Botanical T-Shirt Grafito,CLP 11.490,https://www.lippioutdoor.com/polera-mujer-botanical-t-shirt-grafito-v22.html,mujer,2022-07-27
Poleron Mujer Insigne Full Zip Hoody Sweatshirt Palo Rosa,CLP 42.990,https://www.lippioutdoor.com/poleron-mujer-insigne-full-zip-hoody-sweatshirt-palo-rosa-v22.html,mujer,2022-07-27
Chaqueta Mujer Bear Shaggy-Pro Hoody Jacket Lila Lippi,CLP 51.990,https://www.lippioutdoor.com/chaqueta-mujer-bear-shaggy-pro-hoody-jacket-lila-v22.html,mujer,2022-07-27
Primera Capa Mujer Skintec 1000 Seamless Top Negro Lippi,CLP 22.990,https://www.lippioutdoor.com/primera-capa-mujer-skintec-1000-seamless-top-negro-i21.html,mujer,2022-07-27
Pantalon Mujer Enduring Mix-2 Q-Dry Pants Laurel,CLP 59.990,https://www.lippioutdoor.com/pantalon-mujer-enduring-mix-2-q-dry-pants-laurel-v22.html,mujer,2022-07-27
Camisa Mujer Rosselot Long Sleeve Q-Dry Shirt Verde Grisaceo Lippi,CLP 42.990,https://www.lippioutdoor.com/camisa-mujer-rosselot-long-sleeve-q-dry-shirt-verde-grisaceo-v22.html,mujer,2022-07-27
Poleron Mujer Insigne Sweatshirt Azul Grisaceo,CLP 34.990,https://www.lippioutdoor.com/poleron-mujer-insigne-sweatshirt-azul-grisaceo-v22.html,mujer,2022-07-27
Polera Tank Mujer Summit UV-Stop Melange Azul Lavanda Lippi,CLP 8.990,https://www.lippioutdoor.com/polera-tank-mujer-summit-uv-stop-melange-azul-lavanda-azul-v21.html,mujer,2022-07-27
Botin Mujer Puelo CS Low Café Lippi,CLP 69.990,https://www.lippioutdoor.com/4624-botin-mujer-puelo-cs-low-caf.html,mujer,2022-07-27
Botin Mujer Tellus Mid Uva Lippi,CLP 69.990,https://www.lippioutdoor.com/botin-mujer-tellus-mid-uva-i21.html,mujer,2022-07-27
Polerón Mujer Insigne Hoody Rosa I20,CLP 39.990,https://www.lippioutdoor.com/7965-poler-n-mujer-insigne-hoody-rosa-i20.html,mujer,2022-07-27
Chaqueta Mujer Yeti Negro Haka Honu,CLP 169.990,https://www.lippioutdoor.com/chaqueta-mujer-yeti-negro-haka-honu-m22.html,mujer,2022-07-27
Chaqueta Mujer Zip-porrito Negro Haka Honu,CLP 58.990,https://www.lippioutdoor.com/chaqueta-mujer-zip-porrito-negro-haka-honu-m22.html,mujer,2022-07-27
Poleron Mujer Polaroid Burdeo Haka Honu,CLP 34.990,https://www.lippioutdoor.com/poleron-mujer-polaroid-burdeo-haka-honu-m22.html,mujer,2022-07-27
Bota Mujer Haka Honu Lobita Mostaza,CLP 24.990,https://www.lippioutdoor.com/bota-mujer-lobita-mostaza-i20.html,mujer,2022-07-27
Camisa Mujer Hachazo Negro Haka Honu,CLP 29.990,https://www.lippioutdoor.com/camisa-mujer-hachazo-negro-haka-honu-m22.html,mujer,2022-07-27
Chaqueta Mujer Infiernillo con gorro Negro Haka Honu,CLP 99.990,https://www.lippioutdoor.com/chaqueta-mujer-infiernillo-con-gorro-negro-haka-honu-m22.html,mujer,2022-07-27
Chaqueta Mujer Perro Guapo Negro Haka Honu,CLP 149.990,https://www.lippioutdoor.com/chaqueta-mujer-perro-guapo-negro-haka-honu-m22.html,mujer,2022-07-27
Chaqueta Mujer Zip-porrito Crudo Haka Honu,CLP 58.990,https://www.lippioutdoor.com/chaqueta-mujer-zip-porrito-crudo-haka-honu-m22.html,mujer,2022-07-27
Chaqueta Mujer No-cuero Café Haka Honu,CLP 34.990,https://www.lippioutdoor.com/chaqueta-mujer-no-cuero-cafe-haka-honu-m22.html,mujer,2022-07-27
Poleron Mujer Tokerau insulado Damasco Haka Honu,CLP 29.990,https://www.lippioutdoor.com/poleron-mujer-tokerau-insulado-damasco-haka-honu-m22.html,mujer,2022-07-27
Chaqueta Mujer Perro Guapo Amarillo Haka Honu,CLP 149.990,https://www.lippioutdoor.com/chaqueta-mujer-perro-guapo-amarillo-haka-honu-m22.html,mujer,2022-07-27
Chaqueta Mujer Agua-zero Negro Haka Honu,CLP 89.990,https://www.lippioutdoor.com/chaqueta-mujer-agua-zero-negro-haka-honu-m22.html,mujer,2022-07-27
Bota Mujer Haka Honu Lobita Burdeo,CLP 24.990,https://www.lippioutdoor.com/bota-mujer-lobita-burdeo.html,mujer,2022-07-27
Chaleco Mujer Sureño Print Negro Haka Honu,CLP 69.990,https://www.lippioutdoor.com/chaleco-mujer-sureno-print-negro-haka-honu-m22.html,mujer,2022-07-27
Chaqueta Mujer Perro Guapo Verde Haka Honu,CLP 149.990,https://www.lippioutdoor.com/chaqueta-mujer-perro-guapo-verde-haka-honu-m22.html,mujer,2022-07-27
Bota Mujer Haka Honu Lobita Negro,CLP 24.990,https://www.lippioutdoor.com/bota-mujer-lobita-negro-i20.html,mujer,2022-07-27
Chaleco Mujer Quilin Negro Haka Honu,CLP 59.990,https://www.lippioutdoor.com/chaleco-mujer-quilin-negro-haka-honu-m22.html,mujer,2022-07-27
Poleron Mujer Polaroid Café Haka Honu,CLP 34.990,https://www.lippioutdoor.com/poleron-mujer-polaroid-verde-haka-honu-m22.html,mujer,2022-07-27
Chaqueta Mujer Yeti Print Verde Haka Honu,CLP 169.990,https://www.lippioutdoor.com/chaqueta-mujer-yeti-print-verde-haka-honu-m22.html,mujer,2022-07-27
Sandalia Mujer Carel Café Haka Honu,CLP 24.990,https://www.lippioutdoor.com/sandalia-mujer-carel-cafe-haka-honu-v22.html,mujer,2022-07-27
Botin Mujer Haka Honu Pampa Beige,CLP 74.990,https://www.lippioutdoor.com/botin-mujer-pampa-beige-v22.html,mujer,2022-07-27
Polera Mujer Haka Honu Simetría Hippie Negro,CLP 14.990,https://www.lippioutdoor.com/polera-mujer-simetria-hippie-negro-i21.html,mujer,2022-07-27
Sandalia Mujer Carel Negro Haka Honu,CLP 24.990,https://www.lippioutdoor.com/sandalia-mujer-carel-negro-haka-honu-v22.html,mujer,2022-07-27
Poleron Mujer Cangur-oso Burdeo Haka Honu,CLP 29.990,https://www.lippioutdoor.com/poleron-mujer-cangur-oso-burdeo-haka-honu-m22.html,mujer,2022-07-27
Chaqueta Mujer Agua-zero Verde Militar Haka Honu,CLP 89.990,https://www.lippioutdoor.com/chaqueta-mujer-agua-zero-verde-militar-haka-honu-m22.html,mujer,2022-07-27
Chaqueta Mujer Sin-etica Burdeo Haka Honu,CLP 99.990,https://www.lippioutdoor.com/chaqueta-mujer-sin-etica-burdeo-haka-honu-m22.html,mujer,2022-07-27
Sandalia Mujer Verda Negro Haka Honu,CLP 24.990,https://www.lippioutdoor.com/sandalia-mujer-verda-negro-haka-honu-v22.html,mujer,2022-07-27
Pantalon Mujer Zen Violeta Haka Honu,CLP 24.990,https://www.lippioutdoor.com/pantalon-mujer-zen-violeta-haka-honu-m22.html,mujer,2022-07-27
Botin Mujer Haka Honu Patagon Terracota,CLP 99.990,https://www.lippioutdoor.com/botin-mujer-patagon-terracota-v22.html,mujer,2022-07-27
Primera capa Mujer Puma Austral top Palo Rosa Haka Honu,CLP 19.990,https://www.lippioutdoor.com/primera-capa-mujer-puma-austral-top-palo-rosa-haka-honu-m22.html,mujer,2022-07-27
Primera capa Mujer Huemul bottom Print Celeste Haka Honu,CLP 29.990,https://www.lippioutdoor.com/primera-capa-mujer-huemul-bottom-print-celeste-haka-honu-m22.html,mujer,2022-07-27
Chaqueta Mujer Calur-oso Café Haka Honu,CLP 44.990,https://www.lippioutdoor.com/chaqueta-mujer-calur-oso-cafe-haka-honu-m22.html,mujer,2022-07-27
Pantalon Mujer Moke Negro Haka Honu,CLP 69.990,https://www.lippioutdoor.com/pantalon-mujer-moke-negro-haka-honu-m22.html,mujer,2022-07-27
Chaqueta Mujer Agua-zero Print Jade Haka Honu,CLP 89.990,https://www.lippioutdoor.com/chaqueta-mujer-agua-zero-print-jade-haka-honu-m22.html,mujer,2022-07-27
Camisa Mujer Hachazo Burdeo Haka Honu,CLP 29.990,https://www.lippioutdoor.com/camisa-mujer-hachazo-burdeo-haka-honu-m22.html,mujer,2022-07-27
Poleron Mujer Refugia-T Negro Haka Honu,CLP 37.990,https://www.lippioutdoor.com/poleron-mujer-refugia-t-negro-haka-honu-m22.html,mujer,2022-07-27
Vestido Mujer Haka Honu Aflora Damasco print,CLP 14.990,https://www.lippioutdoor.com/vestido-mujer-aflora-damasco-print-v22.html,mujer,2022-07-27
Chaqueta Mujer No-cuero Negro Haka Honu,CLP 34.990,https://www.lippioutdoor.com/chaqueta-mujer-no-cuero-negro-haka-honu-m22.html,mujer,2022-07-27
Sandalia Mujer Haka Honu Pancora Amarillo,CLP 9.990,https://www.lippioutdoor.com/sandalia-mujer-haka-honu-pancora-amarillo-v22.html,mujer,2022-07-27
Pantalon Mujer Versatiro Burdeo Haka Honu,CLP 44.990,https://www.lippioutdoor.com/pantalon-mujer-versatiro-burdeo-haka-honu-m22.html,mujer,2022-07-27
Botin Mujer Haka Honu Patagon Acero,CLP 99.990,https://www.lippioutdoor.com/botin-mujer-patagon-acero-v22.html,mujer,2022-07-27
Calza Mujer Haka Honu Calzatela Negro,CLP 22.990,https://www.lippioutdoor.com/calza-mujer-calzatela-negro-v21.html,mujer,2022-07-27
Poleron Mujer Taina Negro Haka Honu,CLP 32.990,https://www.lippioutdoor.com/poleron-mujer-taina-negro-haka-honu-m22.html,mujer,2022-07-27
Chaqueta Mujer Noes-Ni Negro Haka Honu,CLP 48.990,https://www.lippioutdoor.com/chaqueta-mujer-noes-ni-negro-haka-honu-m22.html,mujer,2022-07-27
Poleron Mujer Tokerau Pro Jade Haka Honu,CLP 29.990,https://www.lippioutdoor.com/poleron-mujer-tokerau-pro-jade-haka-honu-m22.html,mujer,2022-07-27
Poleron Mujer Haka Honu Cangur-oso Full print,CLP 34.990,https://www.lippioutdoor.com/poleron-mujer-cangur-oso-full-print-v22.html,mujer,2022-07-27
Camisa Mujer Mermelada de Perla Jade Haka Honu,CLP 24.990,https://www.lippioutdoor.com/camisa-mujer-mermelada-de-perla-jade-haka-honu-m22.html,mujer,2022-07-27
Poleron Mujer Tokerau Burdeo Haka Honu,CLP 32.990,https://www.lippioutdoor.com/poleron-mujer-tokerau-burdeo-haka-honu-m22.html,mujer,2022-07-27
Pantalon Mujer Jeans con gin Azul Haka Honu,CLP 49.990,https://www.lippioutdoor.com/pantalon-mujer-jeans-con-gin-azul-haka-honu-m22.html,mujer,2022-07-27
Chaqueta Mujer Sin-etica Negro Haka Honu,CLP 99.990,https://www.lippioutdoor.com/chaqueta-mujer-sin-etica-negro-haka-honu-m22.html,mujer,2022-07-27
Pantalon Mujer Versatiro Negro Haka Honu,CLP 44.990,https://www.lippioutdoor.com/pantalon-mujer-versatiro-negro-haka-honu-m22.html,mujer,2022-07-27
Vestido Mujer Haka Honu Palomita Terracota,CLP 12.990,https://www.lippioutdoor.com/vestido-mujer-palomita-terracota-v22.html,mujer,2022-07-27
Poleron Mujer Tokerau Pro Print Damasco Haka Honu,CLP 29.990,https://www.lippioutdoor.com/poleron-mujer-tokerau-pro-print-damasco-haka-honu-m22.html,mujer,2022-07-27
Chaqueta Mujer Brisa Palo Rosa Haka Honu,CLP 39.990,https://www.lippioutdoor.com/chaqueta-mujer-brisa-palo-rosa-haka-honu-m22.html,mujer,2022-07-27
Chaqueta Mujer Zip-porrito Print Burdeo Haka Honu,CLP 58.990,https://www.lippioutdoor.com/chaqueta-mujer-zip-porrito-print-burdeo-haka-honu-m22.html,mujer,2022-07-27
Traje de baño Mujer Haka Honu Fondo de bikini Vino,CLP 12.990,https://www.lippioutdoor.com/traje-de-bano-mujer-fondo-de-bikini-vino-v22.html,mujer,2022-07-27
Chaqueta Mujer Ultraliviana Print Damasco Haka Honu,CLP 49.990,https://www.lippioutdoor.com/chaqueta-mujer-ultraliviana-print-damasco-haka-honu-m22.html,mujer,2022-07-27
Polera Mujer Norte Sur Burdeo Haka Honu,CLP 13.990,https://www.lippioutdoor.com/polera-mujer-norte-sur-burdeo-haka-honu-m22.html,mujer,2022-07-27
Poleron Mujer Haka Honu Tokerau Pro Palo Rosa,CLP 34.990,https://www.lippioutdoor.com/poleron-mujer-tokerau-pro-palo-rosa-i21.html,mujer,2022-07-27
Traje de baño Mujer Haka Honu Sirena Print beige,CLP 16.990,https://www.lippioutdoor.com/traje-de-bano-mujer-sirena-print-beige-v22.html,mujer,2022-07-27
Primera capa Mujer Haka Honu Huemul Bottom Negro,CLP 29.990,https://www.lippioutdoor.com/primera-capa-mujer-huemul-bottom-negro-i21.html,mujer,2022-07-27
Traje de baño Mujer Haka Honu Fondo de bikini Print azul,CLP 12.990,https://www.lippioutdoor.com/traje-de-bano-mujer-fondo-de-bikini-print-azul-v22.html,mujer,2022-07-27
Poleron Mujer Chi-porrito Oliva Haka Honu,CLP 48.990,https://www.lippioutdoor.com/poleron-mujer-chi-porrito-oliva-haka-honu-m22.html,mujer,2022-07-27
Polera Mujer Norte Sur Negro Haka Honu,CLP 13.990,https://www.lippioutdoor.com/polera-mujer-norte-sur-negro-haka-honu-m22.html,mujer,2022-07-27
Primera capa Mujer Puma Austral bottom Palo Rosa Haka Honu,CLP 19.990,https://www.lippioutdoor.com/primera-capa-mujer-puma-austral-bottom-palo-rosa-haka-honu-m22.html,mujer,2022-07-27
Chaqueta Mujer Haka Honu James Jeans Azul,CLP 35.990,https://www.lippioutdoor.com/chaqueta-mujer-james-jeans-azul-v22.html,mujer,2022-07-27
Poleron Mujer Haka Honu Tokerau insulado Melange Crudo,CLP 41.990,https://www.lippioutdoor.com/poleron-mujer-tokerau-insulado-melange-crudo-v22.html,mujer,2022-07-27
Short Mujer Haka Honu Shortiza Azul,CLP 16.990,https://www.lippioutdoor.com/short-mujer-shortiza-azul-v22.html,mujer,2022-07-27
Traje de baño Mujer Haka Honu Sirena Print morado,CLP 16.990,https://www.lippioutdoor.com/traje-de-bano-mujer-sirena-print-morado-v22.html,mujer,2022-07-27
Sandalia Mujer Verda Café Haka Honu,CLP 24.990,https://www.lippioutdoor.com/sandalia-mujer-verda-cafe-haka-honu-v22.html,mujer,2022-07-27
Poleron Mujer Vest-ir Damasco Haka Honu,CLP 49.990,https://www.lippioutdoor.com/poleron-mujer-vest-ir-damasco-haka-honu-m22.html,mujer,2022-07-27
Chaqueta Mujer Caluro-sin Print Verde Haka Honu,CLP 41.990,https://www.lippioutdoor.com/chaqueta-mujer-caluro-sin-print-verde-haka-honu-m22.html,mujer,2022-07-27
Sandalia Mujer Haka Honu Shalaila Crema,CLP 8.990,https://www.lippioutdoor.com/sandalia-mujer-shalaila-crema-v21.html,mujer,2022-07-27
Chaqueta Mujer Haka Honu Ultraliviana Palo Rosa,CLP 79.990,https://www.lippioutdoor.com/chaqueta-mujer-ultraliviana-palo-rosa-v22.html,mujer,2022-07-27
Poleron Mujer Haka Honu Tokerau insulado Melange Negro,CLP 41.990,https://www.lippioutdoor.com/poleron-mujer-tokerau-insulado-melange-negro-v22.html,mujer,2022-07-27
Poleron Mujer Haka Honu Tio Emiliodon Jade,CLP 43.990,https://www.lippioutdoor.com/poleron-mujer-tio-emiliodon-jade-v22.html,mujer,2022-07-27
Poleron Mujer Refugia-T Palo Rosa Haka Honu,CLP 37.990,https://www.lippioutdoor.com/poleron-mujer-refugia-t-palo-rosa-haka-honu-m22.html,mujer,2022-07-27
Calza Mujer Pampa Mostaza Haka Honu,CLP 34.990,https://www.lippioutdoor.com/calza-mujer-pampa-mostaza-haka-honu-m22.html,mujer,2022-07-27
Chaqueta Mujer Noes-Ni Jade Haka Honu,CLP 48.990,https://www.lippioutdoor.com/chaqueta-mujer-noes-ni-jade-haka-honu-m22.html,mujer,2022-07-27
Pantalon Mujer Haka Honu Mar y Posa Print negro,CLP 14.990,https://www.lippioutdoor.com/pantalon-mujer-mar-y-posa-print-negro-v22.html,mujer,2022-07-27
Poleron Mujer Taina Crudo Haka Honu,CLP 32.990,https://www.lippioutdoor.com/poleron-mujer-taina-crudo-haka-honu-m22.html,mujer,2022-07-27
Pantalon Mujer Zen Negro Haka Honu,CLP 24.990,https://www.lippioutdoor.com/pantalon-mujer-zen-negro-haka-honu-m22.html,mujer,2022-07-27
Chaqueta Mujer Haka Honu Ultraliviana Negro,CLP 79.990,https://www.lippioutdoor.com/chaqueta-mujer-ultraliviana-negro-v22.html,mujer,2022-07-27
Botin Mujer Haka Honu Pampa Turquesa,CLP 74.990,https://www.lippioutdoor.com/botin-mujer-pampa-turquesa-v22.html,mujer,2022-07-27
Vestido Mujer Haka Honu Palomita Grafito,CLP 12.990,https://www.lippioutdoor.com/vestido-mujer-palomita-grafito-v22.html,mujer,2022-07-27
Sandalia Mujer Haka Honu Pancora Rojo,CLP 9.990,https://www.lippioutdoor.com/sandalia-mujer-haka-honu-pancora-rojo-v22.html,mujer,2022-07-27
Chaleco Mujer Quilin Palo Rosa Haka Honu,CLP 59.990,https://www.lippioutdoor.com/chaleco-mujer-quilin-palo-rosa-haka-honu-m22.html,mujer,2022-07-27
Polera Mujer Haka Honu Flora Amarillo,CLP 11.490,https://www.lippioutdoor.com/polera-mujer-flora-amarillo-v22.html,mujer,2022-07-27
Poleron Mujer Tokerau Print Rapa Nui Haka Honu,CLP 32.990,https://www.lippioutdoor.com/poleron-mujer-tokerau-print-pascuense-haka-honu-m22.html,mujer,2022-07-27
Poleron Mujer Haka Honu Tokerau Morado,CLP 32.990,https://www.lippioutdoor.com/poleron-mujer-tokerau-morado-i21.html,mujer,2022-07-27
Poleron Mujer Refugia-T Mostaza Haka Honu,CLP 37.990,https://www.lippioutdoor.com/poleron-mujer-refugia-t-mostaza-haka-honu-m22.html,mujer,2022-07-27
Chaqueta Mujer Bi-polar Negro Haka Honu,CLP 62.990,https://www.lippioutdoor.com/chaqueta-mujer-bi-polar-negro-haka-honu-m22.html,mujer,2022-07-27
Chaqueta Mujer Calentito Café Haka Honu,CLP 48.990,https://www.lippioutdoor.com/chaqueta-mujer-calentito-cafe-haka-honu-m22.html,mujer,2022-07-27
Chaqueta Mujer Vera Burdeo Haka Honu,CLP 41.990,https://www.lippioutdoor.com/chaqueta-mujer-vera-burdeo-haka-honu-m22.html,mujer,2022-07-27
Sandalia Mujer Haka Honu Pancora Negro,CLP 9.990,https://www.lippioutdoor.com/sandalia-mujer-haka-honu-pancora-negro-v22.html,mujer,2022-07-27
Vestido Mujer Haka Honu Aflora Mostaza print,CLP 14.990,https://www.lippioutdoor.com/vestido-mujer-aflora-mostaza-print-v22.html,mujer,2022-07-27
Poleron Mujer Taina Damasco Haka Honu,CLP 32.990,https://www.lippioutdoor.com/poleron-mujer-taina-damasco-haka-honu-m22.html,mujer,2022-07-27
Chaqueta Mujer Caluro-sin Beige Haka Honu,CLP 41.990,https://www.lippioutdoor.com/chaqueta-mujer-caluro-sin-beige-haka-honu-m22.html,mujer,2022-07-27
Chaqueta Mujer Vera Beige Haka Honu,CLP 41.990,https://www.lippioutdoor.com/chaqueta-mujer-vera-beige-haka-honu-m22.html,mujer,2022-07-27
Chaqueta Mujer Calentito Negro Haka Honu,CLP 48.990,https://www.lippioutdoor.com/chaqueta-mujer-calentito-negro-haka-honu-m22.html,mujer,2022-07-27
Poleron Mujer Cangur-oso Print Coral Haka Honu,CLP 29.990,https://www.lippioutdoor.com/poleron-mujer-cangur-oso-print-coral-haka-honu-m22.html,mujer,2022-07-27
Chaqueta Mujer Bi-polar Palo Rosa Haka Honu,CLP 62.990,https://www.lippioutdoor.com/chaqueta-mujer-bi-polar-palo-rosa-haka-honu-m22.html,mujer,2022-07-27
Polera Mujer Haka Honu Polo Negro,CLP 9.990,https://www.lippioutdoor.com/polera-mujer-polo-negro-v22.html,mujer,2022-07-27
Vestido Mujer Haka Honu Palomita Damasco print,CLP 12.990,https://www.lippioutdoor.com/vestido-mujer-palomita-damasco-print-v22.html,mujer,2022-07-27
Pantalon Mujer Haka Honu Jeans con Gin Negro,CLP 14.990,https://www.lippioutdoor.com/pantalon-mujer-jeans-con-gin-negro-v19.html,mujer,2022-07-27
Botin Mujer Haka Honu Pampa Mostaza,CLP 74.990,https://www.lippioutdoor.com/botin-mujer-pampa-mostaza-v22.html,mujer,2022-07-27
Polera Mujer Haka Honu Flora Morado,CLP 11.490,https://www.lippioutdoor.com/polera-mujer-flora-morado-v22.html,mujer,2022-07-27
Polera Mujer Haka Honu Flora Negro,CLP 11.490,https://www.lippioutdoor.com/polera-mujer-flora-negro-v22.html,mujer,2022-07-27
Calza Mujer Haka Honu Calzatela Verde militar,CLP 22.990,https://www.lippioutdoor.com/calza-mujer-calzatela-verde-militar-v22.html,mujer,2022-07-27
Calza Mujer Calzatela Burdeo Haka Honu,CLP 22.990,https://www.lippioutdoor.com/calza-mujer-calzatela-burdeo-haka-honu-m22.html,mujer,2022-07-27
Poleron Mujer Taina Burdeo Haka Honu,CLP 32.990,https://www.lippioutdoor.com/poleron-mujer-taina-burdeo-haka-honu-m22.html,mujer,2022-07-27
Poleron Mujer Haka Honu Ninja Morado,CLP 27.990,https://www.lippioutdoor.com/poleron-mujer-ninja-morado-v22.html,mujer,2022-07-27
Poleron Mujer Haka Honu Emiliodon Camel,CLP 41.990,https://www.lippioutdoor.com/poleron-mujer-emiliodon-camel-v22.html,mujer,2022-07-27
Calza Mujer Calzatela Menta Haka Honu,CLP 22.990,https://www.lippioutdoor.com/calza-mujer-calzatela-menta-haka-honu-m22.html,mujer,2022-07-27
Botin Mujer Haka Honu Patagon Turquesa,CLP 99.990,https://www.lippioutdoor.com/botin-mujer-patagon-turquesa-v22.html,mujer,2022-07-27
Traje de baño Mujer Haka Honu Fondo de bikini Jade,CLP 12.990,https://www.lippioutdoor.com/traje-de-bano-mujer-fondo-de-bikini-jade-v22.html,mujer,2022-07-27
Chaqueta Mujer Calur-oso Negro Haka Honu,CLP 44.990,https://www.lippioutdoor.com/chaqueta-mujer-calur-oso-negro-haka-honu-m22.html,mujer,2022-07-27
Poleron Mujer Tokerau Full print Haka Honu,CLP 32.990,https://www.lippioutdoor.com/poleron-mujer-tokerau-full-print-haka-honu-m22.html,mujer,2022-07-27
Chaqueta Mujer Vera Negro Haka Honu,CLP 41.990,https://www.lippioutdoor.com/chaqueta-mujer-vera-negro-haka-honu-m22.html,mujer,2022-07-27
Primera capa Mujer Haka Honu Huemul Top Negro,CLP 29.990,https://www.lippioutdoor.com/primera-capa-mujer-huemul-top-negro-i21.html,mujer,2022-07-27
Polera Mujer Norte Sur Jade Haka Honu,CLP 13.990,https://www.lippioutdoor.com/polera-mujer-norte-sur-jade-haka-honu-m22.html,mujer,2022-07-27
Vestido Mujer Haka Honu Palomita Jade,CLP 12.990,https://www.lippioutdoor.com/vestido-mujer-palomita-jade-v22.html,mujer,2022-07-27
Chaqueta Mujer Brisa Verde Haka Honu,CLP 39.990,https://www.lippioutdoor.com/chaqueta-mujer-brisa-verde-haka-honu-m22.html,mujer,2022-07-27
Poleron Mujer Taina Nui Burdeo Haka Honu,CLP 29.990,https://www.lippioutdoor.com/poleron-mujer-taina-nui-burdeo-haka-honu-m22.html,mujer,2022-07-27
